,index,Channel ID,Channel Name,Created,Description,Genre,Comment Count,Subscriber Count,Video Count,View Count,Upload Frequency,Popularity,Label
0,345,UCB0d0JLn1WcGYcwwZ87d2LA,Rclbeauty101,2010-12-14,"I make different types of videos ranging from, DIYs, life hacks, comedy, skits, and anything I enjoy making, I hope you enjoy it too! For all business and branding ...",Beauty,2532,13258952,13258952,2862266820,5,2875528304,Popular
1,373,UCHfdTAyg5t4mb1G-3rJ6QsQ,BibisBeautyPalace,2012-11-28,Kontaktadresse/Business Inquiries : bibisbeautypalace@web.de ______ IMPRESSUM Julian Claßen & Bianca Heinicke GbR c/o TiQuest Management GbR ...,Beauty,83,4932036,4932036,1893793930,3,1898726049,0
2,354,UC0YvTCy1I4_a-3pn47_5DBA,"SaraBeautyCorner - DIY, Comedy, Makeup, Nail Art",2012-10-07,"Subscribe for the Coolest and Funniest Beauty Videos! This channel is all about DIY, comedy, makeup tutorials, nail art and other awesome ideas that pop on ...",Beauty,14,7996813,7996813,1296713430,30,1304710257,Inconsistent
3,437,UCWRV5AVOlKJR1Flvgt310Cw,Zoella,2007-02-02,,Beauty,5384,12099656,12099656,1086364800,10,1098469840,Inconsistent
4,438,UCuYx81nzzz4OFQrhbKDzTng,Michelle Phan,2006-07-18,"Just another old soul dreamer with childlike faith. Teaching and inspiring everyone to become their own best makeup artist :) So sit back, enjoy and let's play with ...",Beauty,156897,8969102,8969102,1018898443,18,1028024442,Inconsistent
5,368,UC4qk9TtGhBKCkoWz5qGJcGg,Tati,2010-11-08,"I'M TOTALLY ADDICTED TO MAKEUP and upload unbiased Product Reviews, Tips, Hauls and Tutorial videos on Drugstore & Luxury Beauty Products five days ...",Beauty,1826,4047124,4047124,828841502,1,832890452,Popular
6,446,UCkvK_5omS-42Ovgah8KRKtg,jeffreestar,2006-02-14,MAKEUP ARTIST/COSMETICS CREATOR. Singer/song writer. Fashion whore. Dog lover. * SHOP MY BRAND: http://www.jeffreestarcosmetics.com + FOLLOW ...,Beauty,7597,6912802,6912802,820432260,5,827352659,0
7,445,UCzTKskwIc_-a0cGvCXA848Q,NikkieTutorials,2008-06-23,"N I K K I E T U T O R I A L S  NEW video every Wednesday and Sunday 4:00pm EST/01:00pm PST! Hair & Makeup Artist ∙ When life gives you lemons, punch it ...",Beauty,5573,9792409,9792409,803618056,6,813416038,0
8,353,UCGUkuAaBDkYPdUhIetzLQxQ,Clevver Style,2009-07-12,"Beauty and style tips, tricks, and tutorials! New here?? We're the home of… LUNCHY BREAK every Tuesday!! BEAUTY TRIPPIN every Thursday!! WHAT THE ...",Beauty,195,2644578,2644578,685406923,1,688051696,0
9,357,UC21yq4sq8uxTcfgIxxyE9VQ,Carli Bybel,2011-06-27,FOR ALL BUSINESS INQUIRIES PLEASE CONTACT SETH @ CARLIBYBELPR@gmail.com.,Beauty,2234,5978449,5978449,552721114,6,558701797,0
10,439,UCzco9CewPf0F-SP1p6LhWrw,Gigi Gorgeous,2008-07-07,"I'm a YouTuber & TV personality, lover of beauty, fashion and a good party! ✨STAY GORGEOUS✨Remember you are better than anyone who hates on you for ...",Beauty,17629,2788512,2788512,441144779,6,443950920,0
11,443,UCKTgL5yfBJXIgRbhe4Qs1Mg,bubzbeauty,2007-08-06,"Willing to try. Willing to learn. My VLOG channel: http://www.youtube.com/bubzvlogz or all Business & PR opportunities, please email: bubz@gushcloud.com ...",Beauty,97334,2949341,2949341,427820549,19,430867224,Inconsistent
12,440,UC6jgzx2g3nlbaYkd8EMweKA,Jaclyn Hill,2010-09-07,"Hi I'm Jaclyn Hill from JaclynHill1 on YouTube. I am a professional makeup artist. I'm young, ambitious & full of life. I post makeup tutorials and makeup reviews ...",Beauty,975,5075192,5075192,415949211,12,421025378,Inconsistent
13,415,UCBDR4TSiuXpWFNSA4cxPp6g,womenbeauty1,2011-09-30,Hairstyles by Sklemina Tatiana Please visit my new channel for more hairstyles! http://www.youtube.com/womenbeauty1Ru.,Beauty,353,1277107,1277107,378628343,2,379905803,0
14,442,UCz0Qnv6KczUe3NH1wnpmqhA,Nicole Guerriero,2006-11-27,Don't quit your daydream. 143. - Thank YOU for subscribing. B U S I N E S S: For Business and Branding/PR vanessa@jamesgrant.com ...,Beauty,3830,2903803,2903803,319313460,6,322221093,0
15,355,UCucot-Zp428OwkyRm2I7v2Q,James Charles,2015-12-01,"HI SISTERS! I'm James Charles, an 18 year old kid with a few blending brushes. Subscribe to my channel and join the sisterhood for all things makeup, ...",Beauty,0,4459859,4459859,303493634,4,307953493,0
16,444,UCXbQzhqSvgVZTUyi1T4AU3w,Lauren Curtis,2011-08-31,This channel is centred around all things beauty - from makeup and hair tutorials to product reviews and hauls - I've got everything covered! Thanks for stopping ...,Beauty,1744,3630367,3630367,298968383,7,302600494,0
17,441,UC48DOiEvCDu3sThBijwkQ1A,juicystar07,2008-07-08,Welcome to my channel! I'm Blair Fowler and have been uploading beauty and fashion videos since 2008. Show your support by subscribing! Business Inquires ...,Beauty,120583,1771549,1771549,289666199,4,291558331,0
18,390,UCXzaEAP-03qktmjNF2M4qLg,beautygloss,2007-09-05,Hoi en welkom op mijn beauty youtube channel! Ik ben Mascha Feoktistova en maak sinds 2007 video's op dit kanaal over alles wat met beauty te maken heeft.,Beauty,0,622732,622732,273333273,3,273956005,0
19,450,UCDHQbU57NZilrhbuZNbQcRA,PatrickStarrr,2013-02-27,"Hey YouTube! This is my Makeup, Beauty and Lifestyle channel! ""MAKEUP IS A ONE SIZE FITS ALL"". I love makeup, photography and YouTube! I want boys in ...",Beauty,23,3745304,3745304,228634582,8,232379909,Inconsistent
20,449,UC0KiGuCTrehqzSQ7ikjxSQw,Patricia Bright,2009-02-21,"A Female fashion beauty and hair channel with tutorials and videos to help with your beauty and fashion needs. Style advice Im here, random Life advice I'm ...",Beauty,2930,2307516,2307516,196161846,3,198472292,0
21,453,UCXTAdFsBmxNK3_c8MUvSviQ,Christen Dominique,2009-02-03,SNAPCHAT: Christensnaps INSTAGRAM: ChristenDominique TWITTER: Christendtweets FACEBOOK: Christen Dominique New videos every week!,Beauty,2473,3813462,3813462,182278710,5,186094645,0
22,420,UCzJIliq68IHSn-Kwgjeg2AQ,Jackie Aina,2006-03-12,"Changing the standard of beauty, one video at a time :) New videos Tuesdays, Fridays/Saturdays! Business email: jackie@rare.global Philippians 4:13.",Beauty,1018,2329721,2329721,175073403,3,177404142,0
23,385,UCooQN8b9yPeNQgUFa9S5xew,Samantha Maria,2009-07-22,"Hey there! I'm a London based Fashion & Lifestyle blogger & Youtuber with a penchant for Travelling the world, eating and handbag collecting. I love creating ...",Beauty,11597,1840030,1840030,175541904,4,177393531,0
24,346,UC5lRKBgDMpPas8-VP3wsh0A,Kaushal Beauty,2010-07-05,I like to collect fabulous things and I like to wear lipstick. Want to send me a little letter? PO BOX: Kaushal Beauty C/O Red Hare Somerset House Strand London ...,Beauty,10,1970090,1970090,170679734,7,172649834,0
25,434,UC4GtJWgv_PLBiWFihNGbF0g,eleventhgorgeous,2009-01-31,"Hi! We're Tracy and Stefanie! You can find Morning Routines, Lifestyle, Fashion, Beauty, DIY Projects, Get Ready With Me videos, and more! Subscribe today so ...",Beauty,3991,1783016,1783016,170467433,6,172254440,0
26,402,UCtC8m_F7jX2fGOQ3_nomg4g,emilynoel83,2006-11-08,"I'm Emily! Welcome to my channel- Beauty Broadcast. I'm a former news anchor, a wife, and most recently... a momma! My goal with every video is to provide my ...",Beauty,9499,957639,957639,169155971,2,170123109,0
27,448,UCxj0QizmFhx7kVKSArHBCTA,Casey Holmes,2011-03-09,"HI! I'm Casey- Georgia girl- Makeup & Hair obsessed. If you like my videos, please subscribe so you don't miss out on any of them! xoxox Business inquiries can ...",Beauty,710,1640597,1640597,167385014,5,169026321,0
28,347,UClY87IoUANFZtswyC9GeecQ,Beauty recipes,2015-10-20,"Looking for skin, hair, or nail care tips? Find the latest beauty information here. Disclaimer : These contents or videos are only intended for informational purpose ...",Beauty,0,1148709,1148709,167209269,3,168357978,0
29,447,UCsopuR4Uw3TSA1VPY0MyAfQ,Claudia Sulewski,2009-11-02,,Beauty,6468,1912849,1912849,128995676,12,130914993,Inconsistent
30,344,UCRSvEADlY-caz3sfDNwvR1A,Huda Beauty,2007-01-14,"Hey My Loves!! Thanks for visiting :) I'm Huda, the Founder and CEO of Huda Beauty! For me, makeup has always been so much more than a way to look more ...",Beauty,331,2322181,2322181,128501831,15,130824343,Inconsistent
31,454,UCt5MVT7UbWWtcymqRy0RdcA,TheChicNatural,2008-04-09,"I'm just a girl who loves fashion, beauty & fun! My website: TheChicIsNatural.com For Business & PR opportunities please email: ChicNatural@gushcloud.com.",Beauty,349,1543757,1543757,121618495,11,123162601,Popular
32,358,UC7ta1qj7_Aj1SzT8CA0j-pA,BeautybyNena,2011-12-05,"For all PR and business opportunities please email: Nena@gushcloud.com Latina Social Media Influencer and Beauty Vlogger (Chicago, IL)",Beauty,59,1514919,1514919,113023124,6,114538102,0
33,361,UCSPUsC1K3KOoqh3XRKzOwQw,TheDollBeauty,2009-12-10,"Salut ! Je suis Maroua Alias TheDollBeauty :) Si vous êtes ici, c'est que vous voulez passer du BON TEMPS, rigoler ou apprendre des choses (oui ça aussi) !",Beauty,693,1471275,1471275,112201857,10,113673825,Inconsistent
34,394,UCg0BZXZm905Jr8g3S05XPIw,Beauty Pageants,2016-01-21,"Beauty Pageants is your one-stop destination for all that's happening in and around the world of glamour and beauty. Get the latest news, views and interviews ...",Beauty,0,252533,252533,111857413,1,112109946,0
35,399,UCMrwXWpdmMGV5UPUXYzbPzw,Sahana Beauty Corner,2008-05-09,"SAHANA BEAUTY CORNER is all about collection of latest indian jewellery designs and garments like celebrity garments and Jewellery, diamond jewellery, ...",Beauty,0,303983,303983,97124111,1,97428094,0
36,432,UCkYwlqDr8sBNf0zGolOzF6w,Beauty Mantra,2012-03-25,"Beauty Mantra is all about beauty, makeup and fashion for Indian women. For business and media enquiries get in touch with us at contact@beauty-mantra.com ...",Beauty,3,493812,493812,96722549,7,97216364,0
37,375,UCI64jIDZ9WVgNv-CdR_edyw,Agnieszka Grzelak Beauty,2011-11-23,Cześć! Tu Agnieszka Grzelak Witaj na 3-cim największym kanale urodowym w Polsce! Wyróżnia mnie umiejętność śmiania się z samej siebie i dzielenie się ...,Beauty,1,676557,676557,95072045,9,95748603,Inconsistent
38,366,UCPhfriDQV1gXKKDDotuXGzA,Beauty TV,2017-06-21,,Beauty,0,605376,605376,92589451,1,93194827,0
39,435,UCVMHrytkjpCocTVWEqjSoPw,Saba G Health & Beauty Tips,2016-09-04,"Aslam O Alikum Viewers how are you? Hope you all will be fine and Happy, Today Saba Beauty Tips going to introduced you Beauty tips. in this video I will ...",Beauty,0,988177,988177,88833609,1,89821786,0
40,350,UCVKFs0cesQUEGtn8gQmhbHw,VasseurBeauty,2013-09-06,"Hi, I'm Brittany - I make fun lifestyle videos on DIYs, home organization, cleaning, budgeting, healthy living and more! My goal is to inspire and motivate you to ...",Beauty,0,928174,928174,83801363,4,84729537,0
41,380,UC8f2CDyLibpGYSN3O2LfDwg,Beauty Within,2013-04-23,Beauty Within inspires young women to be better versions of themselves through beauty + wellness content that integrates into their daily lives. Stay in touch: ...,Beauty,16,1025654,1025654,77733882,4,78759552,0
42,418,UCLfpBAyfXl_2VTMigDlGonA,THE ACNE CHANNEL,2006-04-27,"I started this channel in 2009 because I suffered with acne and terrible skin all my life. I was fed up with buying products that were damaging to my skin, so I ...",Beauty,640,215788,215788,67613133,4,67829561,0
43,436,UCIVM3-CW8t3DWDAfm88P27Q,Jennie Jenkins,2010-08-11,Hey guys! This channel is going to show you what i love..from make up looks/tutorials to beauty to fashion and anything else i feel like sharing...Hope you enjoy!,Beauty,2944,642661,642661,65511703,8,66157308,Inconsistent
44,397,UCxkbollceif6wsLpdIFWo0w,The Beauty Writer,2017-03-26,"Beauty Writer channel provide latest fashion news and lifestyle events in Pakistan and India. You will find here new videos about all type of dress design,beauty ...",Beauty,0,272984,272984,63261863,1,63534847,0
45,451,UCVqeaL3p3g5MwzkgXQml0Sg,WilmasBeauty,2011-06-12,En nyligen inflyttat Stockholmsbo som driver två av Sveriges största YouTube-kanaler (WilmasBeauty + Wilma&Emil). På youtube får man följa mitt liv där jag har ...,Beauty,181,313831,313831,62936332,3,63250344,0
46,422,UC8C7sbw7tHN2gD6fE9Cj9rw,Jessica Braun | JAMbeauty89,2013-04-07,"Hey #Jammers! My channel focuses on makeup reviews, demos, hauls, unboxings, vlogs, & more! Snapchat, Instagram, Twitter, Facebook: @jambeauty89 ...",Beauty,6,482088,482088,60703892,2,61185986,0
47,459,UCp3_Zq16GNd-uBVHM8hYQlg,BeautywithEmilyFox,2011-11-19,"Emily Fox Sacrificing her lips since 2014 :P This channel is about my slight obsession with anything beauty related! Love share with you my new purchases, ...",Beauty,0,391332,391332,52643838,4,53035170,0
48,404,UCN781-j50kA-q2CsGqZuzlg,POPSUGAR Beauty,2010-02-12,"POPSUGAR Beauty is a guide to everything a beauty guru needs, delivering fresh makeup tutorials tutorials, beauty tips and product reviews! Learn insider ...",Beauty,260,255885,255885,51873208,9,52129353,Inconsistent
49,382,UCQeSvxVXZXW66yGxAuOVeJg,Beauty Tricks,2017-04-13,Everything about Beauty.,Beauty,0,230020,230020,51342885,3,51572905,0
50,452,UCzUV_ldqQyp17-scwBANlsg,다영 DAYEONG,2011-03-31,김다영의 소소한 유튜브 채널 입니다. 뷰티에 관련된 컨텐츠 위주로 올리고 있지만 종종 일상적인 영상도 올리고 있답니다!,Beauty,0,554475,554475,50838989,10,51393464,Inconsistent
51,374,UCvQgkrOiwcV9_C2Hj2IgeLw,BEAUTY NEWS,2016-01-13,Welcome to BEAUTY NEWS! The home of The Makeup Breakup - the original and the best makeup destroying series on YouTube (and probably everywhere ...,Beauty,0,363622,363622,46386890,2,46750512,Popular
52,400,UCIQFLq1B4Q0SdqN_hb3TSsQ,Fashion Beauty,2017-06-14,"Wellcome To My Channel Faishion Beauty.You will find here new videos about all type of dress design,Kids Dress,beauty tips,Gold jewellery design, mehendi ...",Beauty,0,225276,225276,46403888,1,46629164,0
53,356,UCskRkPSlaht6T_8sNGLdRfA,TheBrilliantBeauty,2009-09-25,"Hi! I'm Jodian, and I make beauty videos every week. Before my teenage years, I had a passion for hair, but not enough money to go to a salon every week.",Beauty,22,441936,441936,46051345,11,46493303,Inconsistent
54,413,UCV-zFVygK6QZT0mHcGRaXfQ,Dilkash Beauty,2016-10-07,Dilkash Beauty provides reliable material on health and Beauty topics and gives latest tips about health and medicine. Dilkash Beauty is your source for original ...,Beauty,0,657900,657900,44715202,1,45373102,0
55,367,UCOMmsjb-VtlubcqaeyHpQVA,TheBeautyBreakdown,2014-02-20,Official youtube for The Beauty Breakdown and Morgan Alison Stewart BUSINESS INQUIRIES ONLY: morgansbeautybreakdown@gmail.com.,Beauty,0,512431,512431,42674094,4,43186525,0
56,362,UC0qI3HpiBua75glb4RV5mWA,Samantha Ravndahl,2013-02-21,BEAUTY / TRAVEL / LIFESTYLE A 20 something doing things and stuff on the internet and also in real life. Let's be friends.,Beauty,2,775799,775799,38220971,8,38996772,Inconsistent
57,411,UCBX-jnm-TVS2SAAwTlD36bQ,ultabeauty,2007-08-21,"Watch All Things Beauty, All in One Place™ on the official Ulta Beauty YouTube channel. Satisfy your beauty cravings one video at a time. Discover new ...",Beauty,9,42910,42910,38423022,6,38465941,Popular
58,421,UCT9B6B1ESokiAH9FubKxqmQ,Aisha Health With Beauty,2016-11-22,"Welcome Friends, Every male and female like beauty and try to look beautiful and different then others, so Friends Beauty is not much expensive every one can ...",Beauty,0,0,0,35213497,1,35213497,0
59,352,UCt414Im4PH8seguhsg5_sJg,BEAUTY INSIDER,2017-10-19,BEAUTY INSIDER believes everyone should shine from hair to makeup and everything in between. Life is an adventure from the team at INSIDER!,Beauty,0,98629,98629,34381225,2,34479854,0
60,456,UCF8C0n8MNYyvjfry_CkbTjA,So Young's Beauty Room ♥,2013-03-20,Business Inquiry : soyoung0201@gmail.com Instagram 인스타그램 : soyoung0201 FB page 페이스북 페이지: https://www.facebook.com/soyoungsbeautyroom.,Beauty,4,375514,375514,33239029,8,33614547,Inconsistent
61,419,UC9HZ8PYXkhgEUR3bqv6xoMQ,Indian Beauty and PunkzGamer,2016-01-22,,Beauty,0,61779,61779,33147568,1,33209347,Popular
62,416,UC9SQfYJSmD2Sly90kvEp-0w,My Beauty Production,2016-07-28,,Beauty,0,63111,63111,27247718,1,27310829,0
63,458,UC7ukCljv3FrDWYMPxu5Jsmw,RositaApplebum,2011-04-25,"""Beneath the makeup and behind the smile, I am just a girl who wishes for the world."" For Business Inquiries Please Feel Free to Contact Me Via Email: ...",Beauty,82,290357,290357,25842398,3,26132837,0
64,403,UC9a7MN5CkhzSQqShcuPGQRg,HW Beauty,2017-01-30,"hello, Viewer welcome to HW Beauty. Hare, we Upload all about health and beauty related videos to make your regular life easy and simple. we upload 3 or 4 ...",Beauty,0,62222,62222,25708167,1,25770389,0
65,376,UCOtoxvHLKrIlWbt4MRBWfbQ,RawBeautyKristi,2013-02-28,"RawBeautyKristi - A place where you can feel confident in getting HONEST Product Reviews, Makeup tutorials, Health, Life & Weight loss advice and MORE.",Beauty,5,377982,377982,25009836,2,25387823,0
66,457,UCC8xufRD5wAPuZny8EY4d_Q,Beauty Broadcast Express,2013-07-16,"If you want honest beauty reviews that are quick and to-the-point, you've come to the right place! Beauty Broadcast Express is an addition to the original Beauty ...",Beauty,11,218709,218709,25081129,3,25299849,0
67,386,UCqsG5w2r7Lo5tsvm8sfU1Jw,Health and Beauty,2016-11-14,"Health & Beauty is a YouTube Channel Provide Full Information about Natural Home Remedies, Health and Beauty Tips, Natural Cure For Diabetes, Weight loss ...",Beauty,0,164638,164638,24703431,1,24868069,0
68,408,UCjXKhMQTMFBOlzY4sxaWkWA,Official Nepali Beauty,2013-10-26,Welcome to the official youtube page of Nepali Beauty where we post about videos regarding the current affairs and viral trends. Follow us on Social Media ...,Beauty,0,42316,42316,24096727,1,24139043,0
69,396,UC7XCHQtpWcYyxG_tJ2z1E4A,Telugu beauty,2016-12-22,"this channel about all telugu news , cinema news.",Beauty,0,43793,43793,22377096,1,22420889,0
70,412,UCVV4hwNGQ-a_ImmoMoJ5JKA,Gabriela,2009-09-16,"NUOVI VIDEO OGNI LUNEDI' MERCOLEDI' e VENERDI' alle 17 Ciao e Benvenuta! Sono Gabriela e nel mio canale troverai make-up, moda, idee, viaggi e ...",Beauty,1717,91077,91077,20813526,5,20906320,0
71,460,UCKrrATalRpJ-H5ltP788DkA,Linda Hallberg,2013-10-17,Hi everyone and welcome to my beauty channel! My name is Linda Hallberg and I upload videos every thursday and sunday here on my channel. I live to create ...,Beauty,4,343013,343013,17326607,10,17669624,Inconsistent
72,423,UCZqlcke50KdyWnSlAohYggw,07vredinka | Beauty Blogger,2011-09-10,BEAUTY & LIFESTYLE Блоггер МОСКВА! Бьюти Блогер! Мама Блогер! На моем канале вы найдете ролики на тему: - уход за...,Beauty,105,104102,104102,17526862,3,17631069,0
73,364,UCsLRTmhjh60vilTencSqvvg,DIY Beauty Channel,2016-10-29,,Beauty,0,109939,109939,17401984,1,17511923,0
74,401,UC-fujoJkUhVNSSE-Wkmk9DQ,真善美truth love beauty,2011-11-26,真善美頻道利用FREE網絡视听素材，分享自製視頻，轉載大眾傳媒和公益宣傳片。如果有免費資源涉及您的版權請留言，會及時移除。This channel is...,Beauty,0,22342,22342,14663659,1,14686001,0
75,428,UC-re4-3ZMIpu94xZRYDDTQQ,Гильдия Красоты,2014-11-22,"ЧЕСТНЫЕ BEAUTY ОБЗОРЫ — ЗДЕСЬ ВОЗМОЖНО ВСЕ, ЧТО КАСАЕТСЯ КРАСОТЫ! Наш канал Beauty Guild переводится как ""Гильдия...",Beauty,0,57576,57576,13504980,3,13562556,0
76,391,UCkdgDPiHPRP-wieF9nQlZ5A,Emci Beauty,2013-12-22,"Emci vagyok! Üdvözöllek a csatornámon:) Iratkozz fel, hogy mindig értesülj az új videóimról melyek divatról és szépségápolásról szólnak. Nézd meg az összes ...",Beauty,0,92105,92105,13325485,6,13417590,Popular
77,409,UCVbiPsqRKlY0i1ta3CKi00A,Hasina Beauty Tips,2017-02-08,,Beauty,0,121840,121840,13209373,1,13331213,0
78,431,UCB_lNo8PKoauzsIWbzTSmSw,smart beauty tips,2016-10-11,"Aslam O Alikum you can also see wazaif, islamic beauty tips, treatment. u can also contact me on my skype id islamic.dunya.",Beauty,0,0,0,12504830,1,12504830,0
79,455,UCmneaCkeBwXk_L5IkLBjmdA,Grace F Victory,2011-03-20,"Born & raised in Buckinghamshire, I left home two years ago to pursue a career in blogging & documentary making for BBC3. I currently live in South West ...",Beauty,2293,227126,227126,12113979,6,12343398,0
80,430,UCw9n9b2MqLYZfZbWsK4g_zw,"Travel, Music & Beauty Videos",2011-10-14,"I make travel Videos mostly of Japan as I have lived there from time to time. I LOVE to cover all aspects of Japanese Culture. Such as, Popular Tourist ...",Beauty,211,64746,64746,12220082,6,12285039,0
81,383,UCeeIqJdljsFxtEoQtwANFQw,Beauty Spectrum,2014-09-10,"Beauty | Fashion | Vlogging | General Life | Join our Spectrumette family by clicking subscribe to see uploads on Tuesdays, Thursdays, Saturdays and Sundays ...",Beauty,0,82463,82463,11648505,2,11730968,0
82,425,UCj3JG5EmD78QTdk9dTPz3dw,Beauty Обзоры для девушек,2016-01-19,"Привет,спасибо,что зашли на наш канал. Мы отвечаем на вопросы наших подписчиц,делимся своим опытом и говори...",Beauty,0,55085,55085,11421419,1,11476504,0
83,360,UCMURcNXDqZGQyk_UhqxDmbw,GiGi Beauty,2015-10-30,,Beauty,0,188826,188826,10316059,3,10504885,0
84,379,UCFjw-ACB8IvXvdjEyRDBOzQ,Kaur Beauty,2016-01-07,"Hi! I'm a professional makeup artist based in Northern California! Here on my channel, you will find makeup, lifestyle, and fashion; be sure to subscribe so you ...",Beauty,0,169997,169997,10086205,5,10256202,0
85,427,UC392qAp0PM-hzVR11QX7xEA,C Key,2010-10-22,"Hey EVERYBODY!!!! If you are looking for tips and tricks on how to enhance your beauty whether it be drugstore or high end products, look no further!!! On my ...",Beauty,58,107389,107389,9452952,5,9560399,0
86,410,UC096bcJfUForNT6Ko3QsEEQ,Beauty Tips In Urdu,2014-10-08,"Looking for skin, makeup, hair or nailcare tips? Watch how to be beautiful and healthy. Beauty tips for quick Fairness skin. Get the latest beauty tips, hair ideas ...",Beauty,0,90257,90257,8904648,2,8994905,0
87,359,UCm6-A3746D0h1382TFjMg4w,MECCA BeautyJunkie,2016-04-07,"Welcome to the Mecca Beauty Junkie channel, your number one online beauty destination for all things 'how-to' and 'must-have' in cosmetics, skin care, hair ...",Beauty,0,27206,27206,7275350,4,7302556,0
88,406,UCfjBWQJdAgmcJEvFIC0zV4Q,Mrs Ginger Beauty,2012-10-20,"I am a 45 Year old English redhead living in beautiful Scotland. I'm married to a wonderful man, & am mum to a mischievous Labradoodle. I've been on You ...",Beauty,2,26956,26956,5724622,2,5751580,0
89,398,UChlIiIEWpFg6OzB6rhDOp2w,LS Beauty,2013-03-05,"Sharing my passion for beauty is this easy ! Skincare, Makeup and Reviews are just part of the deal, so Welcome to all of you Beauty Lovers .... this is our"" Girl ...",Beauty,11,36238,36238,5129634,1,5165883,0
90,349,UCf8IQSVoWAwQbyxkT6LEJ1g,CC Clarke Beauty,2015-08-19,"Wellcome to my world of Music, Makeup and Fashion.",Beauty,0,139836,139836,4577155,6,4716991,0
91,417,UCjL_Lmbufcrmi2iZ47B8kRg,TheMindCatcher Natural Beauty,2007-01-02,Hello and Welcome to my channel. This is a one-stop-shop for ALL Things Beauty and my content is ALWAYS family friendly! On this channel you'll see Natural ...,Beauty,206,47433,47433,4558141,3,4605780,0
92,351,UCjBq1Hbj2Q3fJIv49HdPGIw,RealBeautiful Beauty,2013-01-21,,Beauty,0,0,0,4501395,1,4501395,0
93,395,UCGd92K9MSUBNiqEq1a7zX-w,KLMN Fashion & Beauty,2017-07-18,"Fashion And Beauty This Channel Videos For only Fashion Relates. Videos Post For Women and Men Clothing , Jewels, Beauty..Etc. Women Videos Are ...",Beauty,0,0,0,4183301,1,4183301,Popular
94,371,UCARdH4m1b-P8ThyoBX3ttvg,KD Beauty,2016-11-07,Welcome to my beauty channel  ✨ Snapchat  : q_tayyyy Instagram: kdbeauty21 For PR inquires/ brand collaboration email me: kdbeauty21@gmail.com.,Beauty,0,185725,185725,3902351,13,4088076,Inconsistent
95,424,UCL7f2gRk1q5m1yUyEI3VtVw,NailsRUs Beauty Supply,2013-10-30,"Welcome to Nails""R""US - Professional Beauty Wholesale Supplier & Distributor The channel for ""How To"" for beauty and nails lovers on YouTube. Here you will ...",Beauty,0,20833,20833,3981264,7,4002097,0
96,381,UCEKzXDip-zfAI-qwwCNcXqA,Inner Beauty Bybel,2012-12-10,"I am too positive to be doubtful, too optimistic to be fearful and too determined to be defeated. x Main Channel : https://www.youtube.com/user/CarliBel55.",Beauty,321,404928,404928,3123752,73,3529001,Inconsistent
97,377,UCnNvkq5JhTqeNUbuNvjsLGQ,Beauty by Katty,2014-07-17,"Často vídám ženy bloumat v regálech s kosmetikou. Jsou zadumané, zamračené, hledající. Periferně je pozoruji a přemýšlím, co asi hledají. Dokonalý makeup ...",Beauty,0,0,0,3378426,4,3378426,0
98,389,UCjSz69eLacR7fw8yJYDn7sQ,Beauty secrets reality,2016-04-18,"HELLO MY BEAUTIFUL FRIENDS, MY CHANNEL IS ALL ABOUT BEAUTY SECRETS, BEUTY TIPS, ENTERTAINMENT, SHOPPING, FOOD, HOME REMEDIES ...",Beauty,0,58054,58054,2918991,4,2977045,0
99,407,UCVVHyNSwMSU_1IQFKvo9n1g,Fashion & Beauty,2016-03-14,"The latest fashion and beauty news, tips and trends.Fashion and beauty - latest news and tips. Discover the latest fashion trends and advice on what to wear for ...",Beauty,0,9854,9854,2730144,1,2739998,0
100,363,UCFmsqgrZ1j5Eh69NZyJLLAw,BTK Beauty,2016-10-13,"3 beautiful black girls just trying to make it in life. Watch us juggle school and social life, through a variety of videos. Instagram @btkbeauty @kinadyyyy ...",Beauty,0,57677,57677,2592559,7,2650236,0
101,429,UCZKJYJ1v1akq9ZfquONG6GA,Microscope Beauty,2010-01-03,"Oh, Hello! I'm Kayla, a twenty-something from Michigan. Subscribe for a variety of videos like planning, organization, beauty, graphic design, and vlogs.",Beauty,10,24268,24268,2585158,6,2609436,0
102,405,UCkChY0eiuiKXb57o80eaNUg,Bargain Beauty,2016-03-28,DEAL FINDER ECONOMICAL SOLUTIONS DECORATING ON A BUDGET COUPONING DUMPSTER DIVING CHIARI SURVIOR DEPRESSION ANXIETY THIS ...,Beauty,0,20122,20122,2492212,1,2512334,0
