,index,Channel ID,Channel Name,Created,Description,Genre,Comment Count,Subscriber Count,Video Count,View Count,Upload Frequency,Popularity,Label
426,202,UCjLmlBb3hAPB927mQmijXxw,"UK College of Agriculture, Food, and Environment",2009-03-25,"The official YouTube site for news, information, and educational materials from the University of Kentucky College of Agriculture, Food, and Environment, as well ...",Food,0,13740,13740,3971832,3,3985572,0
427,152,UClVaTk3qfqLti9p_qlV-MjQ,Authentic World Food,2013-11-03,"Food and travel vlog / Youtube channel with authentic video recipes from the countries I traveled to - India, Sri Lanka, Vietnam, Thailand, Indonesia, Malaysia, ...",Food,0,14284,14284,3937335,22,3951619,Inconsistent
428,205,UCI1cW1F_xVgMCQxrYnoGVlg,Old Nerd Reviews,2014-03-26,"I'm an Old Nerd from Vancouver, WA and I rock my channel with food reviews, product reviews, demos and un-boxings, all with a Nerdy twist. JOIN ME and be a ...",Food,0,15336,15336,3329038,2,3344374,0
429,150,UCwVIj-OqEjXNqKpItChRrMQ,Turkish Food Recipes,2013-12-09,"Hello, this is Aysenur Altan. I live in Istanbul. I have a Turkish Recipe channel with near 200 delicious Turkish classic and modern recipes. I own a food website ...",Food,0,29827,29827,3272331,49,3302158,Inconsistent
430,178,UCxAA9ahj7jAiJyJtkKRhDVw,The Food Channel,2006-10-06,"The Food Channel is a trend watching, recipe developing, foodie documentary-producing, digital content creating website dedicated to finding out what's ...",Food,111,9683,9683,3170369,1,3180163,0
431,223,UC9KnqWYOp3kccTq_IevQXYQ,FOOD TV,2013-10-17,"Все для тех, кто любит готовить и есть. Вы научитесь основным кулинарным навыкам и приготовите превосходные...",Food,0,24706,24706,2874452,3,2899158,0
432,163,UCt-LzglDbDB8Uk9gJU7IisQ,Lissa's Raw Food Romance,2009-07-14,Raw Food Romance is all about the love of raw food! Wether you are a full 80/10/10 or Raw till 4 or even just want to incorporate more raw food into your life!,Food,4,36539,36539,2573413,5,2609956,Popular
433,167,UCkMXTIdDGurA3Q43muBhvYQ,jason callan,2013-01-23,"For anyone interested in seeing food & drink review done in a different way. Along with food reviews I do Movie reviews, ASMR, MUKBANG, tell stories of past ...",Food,15,5640,5640,2510246,1,2515901,Popular
434,133,UC-d9fd3MUmY-2ihNMiNs0rA,Craziest Food Competitions,2016-02-26,This channel is about craziest food eating challenges & street food Vlogs.,Food,0,34787,34787,2423512,4,2458299,0
435,140,UClRrcJFPRuk_PeUBA2kCqJA,Food Factory,2015-06-17,,Food,0,43082,43082,1970172,5,2013254,0
436,177,UCTrm5Z760H5HShmt6A6NKuQ,Shared Food,2016-06-13,Food Worth Sharing! Inspire your life with the best content in food! Smiles are contagious. Just like us. :),Food,0,4523,4523,1968237,1,1972760,0
437,123,UCH8MPnIk3j-EESyOdUrjeGA,Ploy's Food Diary,2017-10-04,"IG: nichaploii FB: Ploy's Food Diary หรือ Ploy Natnicha B. Eat,Cook,Activities,Diary,Lifestyle ของ พลอยMasterchefTH.",Food,0,55664,55664,1617943,7,1673607,0
438,176,UCGUbl5Jqptp_eN7EdpwuIig,ลุงต่อพากิน food travel,2012-04-12,สวัสดีครับเพื่อนๆในยูทูปผมได้สร้างยูทูปครั้งแรกด้วยช่องส่วนตัวและ...,Food,0,0,0,1286866,1,1286866,0
439,182,UChYbbOTUzvPE-bzOCaw8ySg,Food and Travel,2015-08-16,,Food,0,2757,2757,1142397,1,1145154,0
440,149,UC3VWL4Y5WQkPvxWkSfRG7WA,food jazz,2013-03-23,"Just like jazz music, the food I prepare is an eclectic mix of recipes that have evolved over the years by many different influences. Some are classic, some are ...",Food,39,7415,7415,1125125,26,1132579,Inconsistent
441,186,UCS0LnHcO2TTWebWbMP2ZAFA,EenaduIndia Food,2015-12-17,"Bringing you the multifarious taste sensation from the land of diversity, India and faring into the exotic world of taste across the globe with Spicebox.",Food,0,5850,5850,1032113,3,1037963,0
442,127,UCz9uUFDhsPYii-ZihoKsbPg,LGR Foods,2017-01-27,I make sandwiches.,Food,0,32945,32945,967963,18,1000908,Inconsistent
443,157,UCVe_8HDwE57tJKxpeJPTSCg,Pho The Love of Food,2017-08-18,Hi! Welcome to our recipe channel! We love to eat and we love to cook and we love to share our favorite recipes with all of you. Every recipe on this channel is ...,Food,0,32353,32353,561910,6,594263,0
444,183,UCaMA2T3UQR0ywpjnJL0Ms5Q,Pearls of Wisdom and Food with Keto,2012-07-07,"Keto is practiced on this channel. Also welcome are LCHF and WW people. We cover food, tracking, grocery hauls and all the emotional pratfalls of the ...",Food,0,3438,3438,588610,1,592048,0
445,213,UCLig6Ad-39Kvezm5StqTjJA,FoodForLouis,2011-05-12,Follow Louis' daily adventures on http://www.youtube.com/FunForLouis.,Food,3053,488458,488458,0,-2,491511,Inconsistent
446,155,UCl_eOmyf4zTWagDbkN331xQ,Glamrs Food,2016-12-22,"Traditional favourites, exotic delicacies from the corners of India, and everything you need to know to become a gourmet cook! Glamrs food is here to take you on ...",Food,0,6616,6616,431302,3,437918,0
447,188,UCcmNwKgXU_PenND1S6W7wtg,Phil's Food Reviews,2008-08-19,"Phil Lempert, The SupermarketGuru, reviews a new food product every day with this updated daily Web Series, Phil's Food Reviews. With over 50000 products ...",Food,0,1327,1327,373236,8,374563,Inconsistent
448,136,UCgfcbgIbG6bw3FkT7AnCo-g,Big Daddy TV - Food Reviews,2017-02-27,"Hello Everybody! My name is Dayton Simpson and Welcome to Big Daddy TV. I will be doing food reviews, NBA videos, Music and More! ***New*** Follow me ...",Food,0,2349,2349,193372,2,195721,0
449,146,UCPQLEr1W1R52H3dvxf9pXmw,Food Tak,2017-07-21,Welcome to Food Tak! A platform that will make you believe that cooking is no rocket science. From our very own desi kitchens to cuisines around the globe.,Food,0,7086,7086,150278,1,157364,0
450,195,UC2zm5ogvs-Yo3KkO1TgBO5w,Street Food,2015-01-22,,Food,0,189,189,156452,1,156641,0
451,139,UCRzhwjX47urgADjs_f97mKw,Food Clothing Music & Shelter (TM),2010-11-04,,Food,0,0,0,112323,1,112323,Popular
452,160,UCpcdPloTijprixyP0as7sDg,Sonal's Food,2017-03-07,"Hi, I am an Indian foodie who makes videos about my main passion food. I share my favorite recipes, health foods, ketogenic recipes, diet information, ...",Food,0,1712,1712,88731,6,90443,0
453,151,UC7zj6w-PCqlgW-pn-jmc4Og,Omg Carl's Food Show,2013-07-12,Food Show. Booze too. Sometimes I get a ride in Cars. And maybe Boats and Watches. Probably not wine. Because wine people wear belts.,Food,0,3502,3502,71609,17,75111,Inconsistent
454,190,UCAE6rpE14yQbWDPJrdu2l-g,ITV Food,2015-01-26,"Welcome to the official YouTube channel for ITV Food. Get previews of our new Food shows and watch clips from some of your favourites including, Let's do ...",Food,0,172,172,58602,1,58774,0
455,164,UCSMZGwceqd20_w4cOrEQ1Ag,Better Than Food: Film Reviews,2015-06-22,A channel dedicated to Films I think are Better Than Food.,Food,0,2791,2791,19291,-2,22082,Inconsistent
456,159,UCeykwchcByjonkMxH25-LNQ,Wesley's Food Den,2018-01-01,Welcome to my kitchen. Nothing brings me greater joy tgan cooking up delicious meals for my family and friends. I mainly cook Indian food and I am originally ...,Food,0,360,360,17358,3,17718,0
457,225,UCKqH_9mk1waLgBiL2vT5b9g,VanossGaming,2011-09-15,Official Vanoss Gaming YouTube Channel.,Gaming,5053,22847685,22847685,9204643785,2,9227496523,0
458,227,UCC-RHF_77zQdKcA75hr5oTQ,FGTeeV,2013-05-24,"FGTeeV, the Family Gaming team, brings you the premiere YouTube channel for family gamers. Meet FGTeeV Duddy his wife FGTEEV Mom or Moomy, their ...",Gaming,55,6161294,6161294,7007514028,3,7013675377,0
459,321,UCrqsNpKuDQZreGaxBL_a5Jg,ComedyShortsGamer,2011-12-01,"Hey guys, ComedyShortsGamer here! My Name is Deji ▻SUBSCRIBE AND JOIN THE TANK FAMILY! ▻MY SHOP: http://shop.comedyshortsgamer.com ...",Gaming,1458,9166185,9166185,3180256964,2,3189424607,0
460,320,UCq54nlcoX-0pLcN5RhxHyug,SeaNanners Gaming Channel,2009-03-04,"Hello everyone! My name is Adam aka SeaNanners. Welcome to my channel! Enjoy Garry's Mod, Minecraft, Call of Duty, or Grand Theft Auto? You've come to ...",Gaming,13263,5669197,5669197,2496533760,6,2502216220,0
461,319,UCERUmrDh9hmqEXBsnYFNTIA,DashieGames,2011-09-14,Comedy gaming commentary! with A LOT of bad words.,Gaming,3117,4374067,4374067,1716697073,1,1721074257,0
462,229,UC2wKfjlioOCLP4xQMOWNcgg,Typical Gamer,2008-08-24,"What's up everybody, Typical Gamer here! Welcome to my channel where I upload daily gaming livestreams and videos featuring games such as GTA 5, Fortnite ...",Gaming,2107,6879451,6879451,1651419921,1,1658301479,0
463,322,UCsvn_Po0SmunchJYOWpOxMg,videogamedunkey,2010-10-21,watch my stupid ass videos.,Gaming,10619,4658812,4658812,1574381677,8,1579051108,Inconsistent
464,228,UC7tHXQXWImq_0I3PCQ8Udaw,Annoying Orange Gaming,2013-11-07,Thanks to Midget Apple who graciously allowed us to convert his channel into THE place for Annoying Orange gaming. New videos EVERY DAY. WOOO!!! Don't ...,Gaming,0,1580365,1580365,1076552234,1,1078132599,0
465,327,UCu3Mp1ZimtNvyA-bcfo9VrQ,カズゲームズ/Gaming Kazu,2013-12-27,カズのゲームチャンネルです。一般的な実況チャンネルではなく、ゲーム系チャンネル。幅広くゲーム系動画つくってきますー.,Gaming,0,1262416,1262416,1043444497,1,1044706913,0
466,323,UCWMYFDuCcvkmPiOf1RP_IKQ,Bigorneaux & Coquillages,2013-04-01,"Cette chaîne s'appelle Bigorneaux & Coquillages, je sais même pas pourquoi. Bref, c'est Cyprien et Squeezie qui font des trucs pas spécialement intelligents en ...",Gaming,2885,5052384,5052384,672039971,18,677095240,Inconsistent
467,230,UCoaWFCFBDCXS030uimjZAkw,TheGamingLemon,2011-06-29,"My name's Brad! I love nothing more than making videos, gaming, and making people laugh. Here I upload comedy based gaming videos over a wide variety of ...",Gaming,4402,3819685,3819685,607166174,20,610990261,Inconsistent
468,234,UC_ItCy-BTDCULPpDPlieUKA,GamingWithJen,2012-11-28,"Hello!! Welcome To My Channel! I'm Jen, a 27 year old girl with a slight obsession with all things cute and girly. I also love to play Minecraft with my husband Pat.",Gaming,6,3944843,3944843,558357823,2,562302672,0
469,326,UCS_BD8cjFA8juZogPH5hEjg,Joey Graceffa,2012-07-24,Hey! My name is Joey! Welcome to my gaming channel! This is where I play a LOT of different video games! From Minecraft and the Sims 4 to Five Night's at ...,Gaming,2153,2487980,2487980,514259206,1,516749339,0
470,267,UCV96ER3MAI1S81HH6l9wwbQ,Mr. Fruit Gaming Channel,2014-01-28,"Double uploads every day! Funny gaming montages to let's plays of a variety of games ranging from Destiny, Overwatch, Call of Duty, Rust, Indie Games and so ...",Gaming,0,1294318,1294318,488586589,1,489880907,0
471,306,UCiZVMOinTQGb8HQu53VbV4Q,Gamer's Little Playground,2009-12-29,MERCHANDISE: shop.spreadshirt.com/gamerslittleplayground/ Stop playing. Start gaming. Home of the Game Movie. The Netflix for Gamers. Any donations are ...,Gaming,101,954965,954965,484057502,1,485012568,0
472,333,UCT2x1vuvgYdhk-kQdlzn6yA,Clash with Cam,2012-12-31,I play Fortnite and I'm a total noob but I'm getting better!! Subscribe for daily streams and videos!,Gaming,0,1741531,1741531,441826239,1,443567770,0
473,231,UCiufyZv8iRPTafTw0D4CvnQ,Neebs Gaming,2014-03-16,"From the Creators of Battlefield Friends, Mob Squad and Doraleous and Associates, we bring you Neebs Gaming! The greatest gaming channel in the world.",Gaming,0,1618543,1618543,432012389,1,433630932,0
474,233,UCyS4xQE6DK4_p3qXQwJQAyA,DidYouKnowGaming?,2012-05-22,"DidYouKnowGaming covers video game facts, Easter eggs, secrets, censorship, glitches and history for many of gaming's biggest names, including the ...",Gaming,765,2186541,2186541,404615398,3,406802704,0
475,328,UCvMQn4d_RFWYShDBCbeuuxw,Adam VS Gaming,2013-02-17,Coming soon.,Gaming,10625,1454029,1454029,374999398,7,376464052,0
476,336,UCx8vbgWs666cAS7wsKos5sA,8-BitRyan,2015-03-18,"Welcome to my channel, my name is Ryan! You can expect to see a variety of gaming content based around just about every genre out there! If this is your thing, ...",Gaming,0,1390281,1390281,358803767,1,360194048,0
477,331,UC2l8G7UE41Vaby59Dfg6r3w,Galadon Gaming,2013-06-12,Clash Of Clans and Clash Royale Attack Strategy! Your trusted source for Clash Royale Gameplay and Clash of Clans Attacks!,Gaming,5,1490001,1490001,358442224,1,359932230,0
478,284,UCGhs9S33RAeT5DEuKTO4Oew,Force Gaming,2010-07-28,Gaming news and commentary since 2010.,Gaming,7952,751853,751853,310107848,2,310867653,0
479,255,UCyfG7-7lPhf6EIC6igUOfzw,TFS Gaming,2013-02-28,"Welcome to the Team Four Star Gaming channel! Here you'll find your favorite actors, characters, and everything in-between as they play through some of their ...",Gaming,382,691681,691681,275497198,1,276189261,0
480,340,UCv_hGnLMl_l4YfDEpwCaOGQ,Fed X Gaming,2009-05-18,Hello everyone Fed X Gaming here! I hope you like tutorials! Twitter - https://twitter.com/FedEx2692 Facebook - https://www.facebook.com/fedex.gaming?fref=ts...,Gaming,45,1089119,1089119,225923691,7,227012855,0
481,294,UCeJTUiYP64xtfzpL-AagZGA,Unit Lost - Great British Gaming,2011-01-25,Unit Lost GREAT BRITISH GAMING! Overwatch is my thing! Daily videos! Join our gaming community forums - http://www.unitlost.com We also Live Stream over ...,Gaming,169,659286,659286,221855748,1,222515203,0
482,329,UCW07alAefFXWdo7RgEDtBcQ,TheDevildogGamer,2011-10-12,Former Marine Grunt Turned Gamer! Q. What was your MOS? A. 0311 Rifleman - Designated Marksmen Q. What Rank did you leave as A. Lance Corporal Q.,Gaming,1217,900636,900636,219499480,1,220401333,0
483,236,UCvO9Xk3bheuxEemvknCj72g,WhatCulture Gaming,2015-09-22,,Gaming,0,830221,830221,213939019,1,214769240,0
484,244,UC9wMap3yZJl5eLed5tqxcHw,BlastphamousHD Gaming,2013-06-05,"I do mostly Lets Plays,and Crazy Stories from my life over awesome gameplay, I also do video game Music Parodies,and video gaming voice over dubs but less ...",Gaming,29,1000304,1000304,206809259,10,207809592,Inconsistent
485,304,UC-zjH-e5XBzMpy_VtwIGRxQ,Arekkz Gaming,2013-01-12,"The best Channel for Destiny 2, Monster Hunter World, The Division & More. Arekkz Gaming is a YouTube gaming channel dedicated to covering all games, with ...",Gaming,1,779915,779915,201996737,1,202776653,0
486,324,UCaDFEed7JBxC2lnP5I2AktQ,Inside Gaming,2008-06-01,,Gaming,466,555276,555276,197804844,1,198360586,0
487,334,UCY-aY6fAqJauPWfxZ7HTZig,2J Games,2014-08-25,Καλώς ορίσατε στο No.1 Ελληνικό Gaming κανάλι sto Youtube! • Business Inquiries: 2j@2jentertainment.com • Instagram: instagram.com/official2j/ • Facebook:...,Gaming,0,674601,674601,183593170,4,184267771,0
488,285,UC2nMSE3t71qC8sG06WSJnMg,RageGamingVideos,2010-08-15,"I'm a channel with a focus on the viewer, they're part of nearly every series, they shape the way things go and create stories from what happens in all the various ...",Gaming,7105,591542,591542,173041684,1,173640331,0
489,338,UCB4GZzsP0IJKWX8-IhEOnDQ,Jeremy - Gaming Curios,2012-07-06,"League of Legends - Jeremy ""Gaming Curios"" - Video Essays Covering Topics Primarily Related To League of Legends, as well as other information videos ...",Gaming,101,529487,529487,173008354,6,173537942,0
490,316,UCjsI5DaCl64zRxqYYep0T_A,Mrtweeday - CSGO Gaming and more! :),2010-07-08,For the people wondering regarding my PC specs: Here are the most important ones: Intel® Core™ i7-3770K Prozessor (4 x 3.5 GHz - 3.9 GHz) - 16 GB DDR3 ...,Gaming,1342,690305,690305,166343705,5,167035352,0
491,325,UCXJL3ST-O0J3nqzQyPJtpNg,Preach Gaming,2010-05-22,The PG Team Variety Gaming Content The Team of Mike and Andy have been striving to entertain since they were children with flashes of even being pro ...,Gaming,837,342336,342336,133439704,2,133782877,Popular
492,280,UCjmKdx8yjoYIVxRnsSyPw7w,CYCHREUS GAMING,2007-12-24,Paypal Donation Link https://streamlabs.com/cychreusgaming MAIL BAG is now active! You can send me your lego sets or any other video game item ...,Gaming,1565,64715,64715,131280572,1,131346852,0
493,286,UCF6xAMHVH3o3rhpAjgQt3XA,Dave's Gaming,2009-09-09,Oldest Video game Player On youtube at age of 55 years Old Why I Love Gaming? 1-Best HD quality on Youtube. I use Latest and Best recording Tools.,Gaming,6,125171,125171,129011216,1,129136393,Popular
494,250,UCJLFizUO3gCQnyiYKMYvUgg,Get Good Gaming,2015-04-08,Welcome to our gaming channel! We make the best LAN multiplayer videos around!,Gaming,0,1026627,1026627,122718760,2,123745387,0
495,332,UCVhkzoReyB25jpFEeXjh3kQ,OpTic Gaming,2009-09-05,The Global Leader in Gaming Entertainment.,Gaming,1409902,1411124,1411124,115014942,2,117835968,0
496,253,UC4-GMuJw3JIxfqXQlvvv93Q,Super Gaming Family,2008-05-27,"Super Gaming Family also known as SGF is a Family Gaming team that brings you the best YouTube channel for family gamers. There are 4 of us in the family, ...",Gaming,49,228290,228290,113596791,1,113825130,0
497,335,UC13nPkrDQH0A2s2vx_NAVdQ,TheXPGamers,2010-07-11,Hello Ladies and Gentlemen! CaptainShack here and welcome to my personal channel TheXpGamers. Here you will find videos primarily focused on one of the ...,Gaming,23,341561,341561,112207269,1,112548853,0
498,296,UC-S7xonqgsyX5DyjI83uIQg,Steparu.com Gaming News and Previews,2010-02-08,"Foreign Gaming Reviews, News, Media, and Information. 외국게임 리뷰, 뉴스, 영상, 정보 http://steparu.com/ https://www.facebook.com/Steparus/ Copyright ...",Gaming,390,151566,151566,104172745,1,104324701,0
499,301,UCg7ILQaLokw0zjKBU31STSA,The Super Gaming Bros.,2009-06-29,"A group of guys who enjoy recording commentary with games they love, and games they hate. It all depends on what we're in the mood for, but each of us tries ...",Gaming,4247,109830,109830,101636483,1,101750560,0
500,278,UCY_wPnc5xrvPekvHpLAvZvQ,Sports Gaming Universe,2011-04-26,Sports Gaming Universe is all about combining the sports and gaming passions into a one stop shop experience for fans alike. From Vintage sports games on ...,Gaming,1493,206800,206800,99276603,1,99484896,0
501,337,UCbShavGeOHnfiKn2qsYSv2A,LachlanPlayz - Gaming & Lets Plays!,2014-11-21,"Hey guys it's Lachlan Here with my 2nd Channel on Youtube! This is where I will post all of my gaming content that isn't Minecraft, I hope you enjoy the videos ...",Gaming,0,680896,680896,87010999,2,87691895,0
502,271,UC5Dc5w_PvV_W_BGCCsvfIIQ,Realistic Gaming,2016-05-25,"ROBLOX CONTENT EVERYDAY AT 3:30 PM (PACIFIC TIME) LIVE STREAMS AS WELL. ALSO OTHER GAMES LIKE FORTNITE, FNAF, MINECRAFT. PLEASE ...",Gaming,0,147395,147395,81252203,1,81399598,0
503,279,UCbLIqv9Puhyp9_ZjVtfOy7w,MLGCOD,2012-12-20,"MLG (Major League Gaming), a division of Activision Blizzard, is a worldwide leader in esports and serves as the operational foundation, partnership hub, and ...",Gaming,289,572790,572790,80750849,1,81323928,0
504,288,UCMnsoyAN78r5WuKNgVxwpzA,Ushi Gaming Channel,2011-11-28,"I'm an ordinary guy who loves to play games, make cool & funny videos about games. You can find strategy, guide, tips, live commentary, funny moments, etc in ...",Gaming,0,133203,133203,80722494,1,80855697,0
505,254,UCC6ulNJ-KDoIa3VI2gcvQpA,Camodo Gaming,2016-01-05,"Hello, I'm Camodo Gaming. Look for let's plays, first Impressions, and other random things to be added to the channel! Current Games: Brick Rigs, Scrap ...",Gaming,0,277467,277467,79988321,1,80265788,0
506,283,UCtSP1OA6jO4quIGLae7Fb4g,Rocket Beans TV Gaming,2013-06-13,Rocket Beans TV steht für 24/7-Entertainment-Power rund um Gaming und Popkultur! Seit seinem Start am 15.01.2015 hat sich Deutschlands einziger ...,Gaming,159,181945,181945,78486348,1,78668452,0
507,224,UCOpNcN46UbXVtpKMrmU4Abg,Gaming,2013-12-15,"YouTube's gaming channel, featuring news, reviews, playthroughs, and more. This channel was generated automatically by YouTube's video discovery system.",Gaming,0,77883079,77883079,0,-2,77883079,Inconsistent
508,239,UCi-xN4ZB6e-0JcXzvBEomlw,Gaming Sound FX,2014-10-31,"The #1 source for all your gaming sound effects needs. Choose from a range of high quality clips, that are guaranteed to improve your video content. Want a ...",Gaming,0,263168,263168,77275049,16,77538217,Inconsistent
509,261,UCy3avhfHpBbbgwZpNvuVklg,Hutts,2013-01-20,"Hi, I'm Hutts! :D  I upload daily videos, twitch stream every Tuesday and Thursday at 3PM Central. Occasionally I stream on the weekend. Welcome to my ...",Gaming,9,212312,212312,76869222,2,77081543,0
510,260,UCodK-9eXEm_hWSDDfLr4QzA,Pretty Good Gaming,2015-05-30,"We talk about video games every day on this channel, with news coverage, review round-ups, talking points and our own opinions. We do our best to call out the ...",Gaming,0,304327,304327,74425129,1,74729456,0
511,330,UC4mLMb49hqk4y9lVFtfanlg,ZiggyD Gaming,2011-02-03,"G'day ZiggyD here! This channel is a place for us to share our passion about deep, detailed and difficult games! I love Action RPGs, old-school RPGs, Real Time ...",Gaming,94,190271,190271,73062377,5,73252742,0
512,226,UC-6Ygz2yrPcPPhl4pAobqNQ,Fail Time!,2016-12-26,Join the Hi5 crew in reacting to strange and wacky things you guys send us!,Gaming,0,844730,844730,71778980,5,72623710,Popular
513,339,UCgiJxU4CSEjQ67FylcZ_8qw,VERTiiGO GAMING,2013-09-08,"My Name is Brendon and i love gaming so decided i would start uploading some of my gameplays, I play everything from RTS to FPS to MMO to Sports so i will ...",Gaming,0,417337,417337,71058751,4,71476088,Popular
514,246,UC2rTtwvsGnlzrY5lrTy70VQ,ChesnoidGaming,2013-02-18,This is THE place to get the BEST FIFA 18 Career Mode content on YouTube!! Plenty of FIFA 18 Career Modes for you to enjoy with multiple series!! I upload ...,Gaming,1,255035,255035,68814014,1,69069050,0
515,241,UC97XthQ7oIOfAWIGPoyFDYQ,Legends of Gaming NL,2015-12-08,"Het meest spectaculaire, epische game-toernooi op YouTube! Gaming PC's en hardware geleverd door http://www.informatique.nl Check de vernieuwde 2.0 ...",Gaming,0,375732,375732,57526166,3,57901898,0
516,291,UCB-UY_HpZgYMfkYi2Xxs-lA,Zueljin Gaming,2011-11-28,"I'm Zueljin! A gamer, content creator, & influencer! Zueljin Gaming is a channel dedicated to games of all types. Daily video uploads of new and upcoming ...",Gaming,186,303378,303378,57161407,1,57464971,0
517,308,UCKEJZ-dqIA03evnzEy1_owg,Welsknight Gaming,2014-09-15,"Hermitcraft Member, Husband, Soldier. Creating family-friendly gaming content since September 2014. When it comes to Minecraft, I do modded and vanilla ...",Gaming,0,279228,279228,56779379,1,57058607,0
518,307,UCc9CTSbRSrQoFnA1lgVCCuA,TheGameHuntah Gaming,2012-05-13,"The BEST Mobile Gaming channel on Youtube ! In here you will find family friendly content and tons of Mobile games (iOS, Android and Windows) Some of the ...",Gaming,23,107290,107290,55592422,2,55699735,0
519,275,UC8Udz9i3cflPNE6XvnL_tHw,Red's 3rd Dimension Gaming,2010-12-31,Welcome to my Gaming Channel! My favorite Video Game Genres are Role-Playing Games [RPGs and JRPGs] and Horror. My Channel mainly consists of ...,Gaming,1340,59830,59830,46274943,1,46336113,0
520,302,UC5I3vUh2iNfQ3pCU3sodYRA,Amazing Gaming Music,2012-09-03,Amazing Gaming Music is promo channel. Amazing Gaming Music is the vibes music. we promo and trend music edm.. If YOU OWN label record ( we need all ...,Gaming,36,386786,386786,45645056,1,46031878,0
521,235,UCnbvPS_rXp4PC21PG2k1UVg,Gaming Historian,2006-07-17,The Gaming Historian is a documentary series all about the history of video games. I also like to review books and certain games that I find interesting. The show ...,Gaming,1335,418490,418490,39470339,22,39890164,Inconsistent
522,305,UCN5XTcPfZXsaEPevaP0VINQ,Csonti Gaming,2010-02-12,"Egy gamer vagyok, akit érdekelnek a videó játékok és a játék ipar, amikről szeretek a szórakozás mellett érdemben is megnyilatkozni. Rendszeresen próbálok ki ...",Gaming,47,111067,111067,39344156,2,39455270,Popular
523,311,UCoMloO7Xla-QyPPsTKsN_Lw,HappyThumbsGaming,2011-10-07,Welcome to Happy Thumbs Gaming(HTG)☺ Where Gaming is Fun and Thumbs are Happy. Our goal is to make HD quality videos that are easy to follow and ...,Gaming,141,86688,86688,35310897,1,35397726,0
524,315,UCNoLwxiLiQIKX2Lk0WuTgkw,Pravus Gaming,2012-04-22,New content available every weekday with a strong focus on strategy games or anything with a good story. Videos can range from silly and whimsical to ...,Gaming,3,146626,146626,34771501,1,34918130,0
525,252,UC6LHN4GnT2ui5wRBQanNKxQ,Semenix Gaming,2013-05-24,Semenix Gaming 遊戲電影頻道創立於2013年5月。 致力於提供最快速、最清晰、最流暢、最高畫質、最不拖戲的中文化遊戲劇情電影！ 希望每個遊戲愛好者...,Gaming,0,146510,146510,33454491,6,33601001,0
526,342,UC2vUKoTGIwNYq4LO0YWKPIg,HappyConsoleGamer,2008-03-17,Retro gaming fun! SUBSCRIBE! Please enjoy! Support us on Patreon! https://www.patreon.com/happyconsolegamer I'm your host Johnny Millenium and I ...,Gaming,5719,173320,173320,31891816,3,32070855,0
527,292,UCHJFAuEQJm74w5_aI033sWg,999 Gaming,2014-09-18,"The latest news for The Walking Dead, The Walking Dead Spoilers and Hidden Clues, The Walking Dead Game Play, The Walking Dead Road to Survival, The ...",Gaming,0,71115,71115,30817379,1,30888494,0
528,310,UC_dkX2_MJZeiYZImFN8AOvg,Most Valuable Gaming,2014-03-30,High Production Competitive Gaming. Informative & Fun Casual Gaming. And the story between the lines. Find. Your. Place.,Gaming,0,59412,59412,28802253,2,28861665,Popular
529,269,UCWKes6ZQ0e9Uwvlpi8Ng85g,Bodil40 Gaming ;),2013-12-06,"Hey guys, my name is Martin also known as bodil40 and ... apparently I play all sorts of different games too! :D Not just minecraft! On this channel I'm going to be ...",Gaming,0,300475,300475,28042450,26,28342925,Inconsistent
