,Channel ID,Channel Name,Created,Description,Genre,Subscriber Count,Subscriber/Video,Video Count,View Count,Views/Subscriber,Views/Video,Comments/Upload,Comments/View,Days/Upload,Dislikes/Upload,Dislikes/View,Growth Rate,Likes/Upload,Likes/View,Views/Upload
277,UCuhwvTYFvVZjyBVXc9T7CrA,DanAndPhilGAMES,2014-05-02,"Two British guys gaming together. Check out our videos and subscribe for Let's Plays, Challenges, Reviews and more!",Gaming,3126845,13138.004201680673,238,511407864,163.55395422542531,2148772.537815126,9791.74,0.9805567979102249,3.8,276.42,0.02781377089053375,0.006675083219780851,91260.5,9.223273209374419,999690.72
278,UCtSP1OA6jO4quIGLae7Fb4g,Rocket Beans TV Gaming,2013-06-13,Rocket Beans TV steht für 24/7-Entertainment-Power rund um Gaming und Popkultur! Seit seinem Start am 15.01.2015 hat sich Deutschlands einziger ...,Gaming,182329,33.17485443959243,5496,78705442,431.6671621080574,14320.495269286754,138.82,0.5461767504925169,0.5,42.3,0.39484759062904395,0.005581103479015635,879.6,3.9066287538064035,24948.92
279,UCaDFEed7JBxC2lnP5I2AktQ,Inside Gaming,2008-06-01,,Gaming,555122,1031.825278810409,538,197850459,356.4089677584387,367751.78252788103,813.94,0.24776483441249125,1.1,97.6,0.030252738382649535,0.9916726651335726,8587.96,2.4721711747776745,348491.28
280,UCXJL3ST-O0J3nqzQyPJtpNg,Preach Gaming,2010-05-22,The PG Team Variety Gaming Content The Team of Mike and Andy have been striving to entertain since they were children with flashes of even being pro ...,Gaming,342769,175.9594455852156,1948,133708211,390.0825658096269,68638.71201232033,379.82,0.4949289311723055,1.8,53.38,0.05981298968688258,-0.8144700026120713,1309.18,1.9061473772141375,79425.22
281,UCS_BD8cjFA8juZogPH5hEjg,Joey Graceffa,2012-07-24,Hey! My name is Joey! Welcome to my gaming channel! This is where I play a LOT of different video games! From Minecraft and the Sims 4 to Five Night's at ...,Gaming,2489190,1429.747271682941,1741,514953057,206.87575355838646,295780.0442274555,1722.8,1.0700385098003675,1.4,108.04,0.07544062476329966,-1.3541723141908757,7953.94,5.433462747213815,159709.18
282,UCGhs9S33RAeT5DEuKTO4Oew,Force Gaming,2010-07-28,Gaming news and commentary since 2010.,Gaming,751406,161.00407113777587,4667,310262698,412.9095296018398,66480.11527748017,465.5,0.5663068843800664,2.5,177.7,0.23935420009846775,-1.3188035766035244,2286.44,2.670239016295921,118730.7
283,UCu3Mp1ZimtNvyA-bcfo9VrQ,カズゲームズ/Gaming Kazu,2013-12-27,カズのゲームチャンネルです。一般的な実況チャンネルではなく、ゲーム系チャンネル。幅広くゲーム系動画つくってきますー.,Gaming,1263515,608.6295761078998,2076,1045170070,827.1924512174371,503453.7909441233,928.74,0.44363029385967623,0.7,96.54,0.05045420319921037,-0.26137534716023897,2317.8,1.246736253861639,193331.64
284,UCvMQn4d_RFWYShDBCbeuuxw,Adam VS Gaming,2013-02-17,Coming soon.,Gaming,1453532,2024.41782729805,718,375212253,258.13828178533396,522579.73955431755,519.04,0.4638879184951486,7.1,56.78,0.05067832491280905,-0.0713669069894957,4056.6,3.591775086831857,120067.66
285,UCW07alAefFXWdo7RgEDtBcQ,TheDevildogGamer,2011-10-12,Former Marine Grunt Turned Gamer! Q. What was your MOS? A. 0311 Rifleman - Designated Marksmen Q. What Rank did you leave as A. Lance Corporal Q.,Gaming,901144,475.0363732208751,1897,219748956,243.8555391813073,115840.25092250922,229.94,0.42925545366257306,1.1,65.32,0.1259037292582736,0.01784649000404631,1303.8,2.4389451649499465,55924.26
286,UCg7ILQaLokw0zjKBU31STSA,The Super Gaming Bros.,2009-06-29,"A group of guys who enjoy recording commentary with games they love, and games they hate. It all depends on what we're in the mood for, but each of us tries ...",Gaming,109870,38.94718185040766,2821,101756546,926.154054792027,36071.09039347749,156.54,1.5867791787055223,0.6,4.1,0.04177563588071015,-1.3309924683618475,388.78,3.9615156504942495,10585.22
287,UC4mLMb49hqk4y9lVFtfanlg,ZiggyD Gaming,2011-02-03,"G'day ZiggyD here! This channel is a place for us to share our passion about deep, detailed and difficult games! I love Action RPGs, old-school RPGs, Real Time ...",Gaming,190205,104.27905701754386,1824,73091077,384.2752661601956,40071.86239035088,92.5,0.32511154519921165,4.9,32.92,0.16572187983965198,-0.11686722642379493,579.54,1.7006035530730343,39634.88
288,UCjsI5DaCl64zRxqYYep0T_A,Mrtweeday - CSGO Gaming and more! :),2010-07-08,For the people wondering regarding my PC specs: Here are the most important ones: Intel® Core™ i7-3770K Prozessor (4 x 3.5 GHz - 3.9 GHz) - 16 GB DDR3 ...,Gaming,689754,317.8589861751152,2170,166379142,241.2151897633069,76672.41566820277,186.86,0.6876282889860645,4.4,44.7,0.17541348441844853,-0.36995410669595147,1147.7,4.836452042345497,23825.54
289,UCMnsoyAN78r5WuKNgVxwpzA,Ushi Gaming Channel,2011-11-28,"I'm an ordinary guy who loves to play games, make cool & funny videos about games. You can find strategy, guide, tips, live commentary, funny moments, etc in ...",Gaming,133289,34.91068622315348,3818,80816085,606.3222396446819,21167.12545835516,54.74,0.9536341705735769,0.4,5.96,0.10518617417242715,-1.8867592575370538,123.92,2.226041481194517,5776.9
290,UC2l8G7UE41Vaby59Dfg6r3w,Galadon Gaming,2013-06-12,Clash Of Clans and Clash Royale Attack Strategy! Your trusted source for Clash Royale Gameplay and Clash of Clans Attacks!,Gaming,1490481,869.0851311953353,1715,358598999,240.59280125006626,209095.62623906706,304.36,0.8652100693104381,1.3,94.0,0.2585782359643709,-0.8208475623597744,1177.92,3.3720484266024564,39057.72
291,UCVhkzoReyB25jpFEeXjh3kQ,OpTic Gaming,2009-09-05,The Global Leader in Gaming Entertainment.,Gaming,1413577,1273.492792792793,1110,115309661,81.57296065230264,103882.57747747748,270.14,0.5222382127631844,1.6,169.96,0.4465594249227294,1.0179421996244689,2425.7,4.579456066815843,52668.68
292,UCT2x1vuvgYdhk-kQdlzn6yA,Clash with Cam,2012-12-31,I play Fortnite and I'm a total noob but I'm getting better!! Subscribe for daily streams and videos!,Gaming,1742104,1684.8201160541587,1034,442058313,253.74966879130062,427522.5464216634,128.6,0.4686274123198516,1.0,81.26,0.2739565003612282,-1.8745009126098877,992.28,3.712505498310225,31115.86
293,UCeJTUiYP64xtfzpL-AagZGA,Unit Lost - Great British Gaming,2011-01-25,Unit Lost GREAT BRITISH GAMING! Overwatch is my thing! Daily videos! Join our gaming community forums - http://www.unitlost.com We also Live Stream over ...,Gaming,659305,199.00543314216722,3313,222161664,336.9634145046678,67057.55025656505,1128.36,1.568066692101906,0.6,168.86,0.2766724174511739,-0.4503085754070478,2229.86,2.978769906896301,78535.24
294,UCY-aY6fAqJauPWfxZ7HTZig,2J Games,2014-08-25,Καλώς ορίσατε στο No.1 Ελληνικό Gaming κανάλι sto Youtube! • Business Inquiries: 2j@2jentertainment.com • Instagram: instagram.com/official2j/ • Facebook:...,Gaming,678211,2166.8083067092653,313,184308888,271.75744421721265,588846.2875399361,5899.66,2.2820413869412954,4.0,415.56,0.152650209647633,-0.0440461037373144,13826.08,5.281876103953773,280461.3
295,UC2nMSE3t71qC8sG06WSJnMg,RageGamingVideos,2010-08-15,"I'm a channel with a focus on the viewer, they're part of nearly every series, they shape the way things go and create stories from what happens in all the various ...",Gaming,592150,137.9017233348859,4294,173343341,292.735524782572,40368.73334885887,368.0,0.6609824618203325,0.8,53.84,0.0853490941124093,-1.5612437468413267,1988.36,3.848893760589964,57811.52
296,UC13nPkrDQH0A2s2vx_NAVdQ,TheXPGamers,2010-07-11,Hello Ladies and Gentlemen! CaptainShack here and welcome to my personal channel TheXpGamers. Here you will find videos primarily focused on one of the ...,Gaming,341753,211.48081683168317,1616,112412753,328.92982065995034,69562.34715346535,188.0,0.5230757819119827,1.1,19.94,0.05041081274268503,-0.7195267394483055,1175.38,3.436525289524793,37584.52
297,UCFhc9fgFQBvZ9iH3BfLK9Ow,CrapgamerReviews,2011-05-29,"I DO NOT HAVE A GMAIL ACCOUNT. Business inquiries crapgamer2008@hotmail.com I'm The Crapgamer, the one and only. The most compelling game ...",Gaming,47048,16.456103532703743,2859,27177592,577.6566910389389,9505.978314095837,444.34,4.54361285368631,0.3,186.1,1.6372182738563779,-21.534412834684964,437.52,4.154690356301337,16373.4
298,UCN5XTcPfZXsaEPevaP0VINQ,Csonti Gaming,2010-02-12,"Egy gamer vagyok, akit érdekelnek a videó játékok és a játék ipar, amikről szeretek a szórakozás mellett érdemben is megnyilatkozni. Rendszeresen próbálok ki ...",Gaming,111141,42.16274658573597,2636,39378899,354.3147803240928,14938.884294385432,34.22,0.3666593638226539,1.9,11.8,0.12190308915021482,-0.464060071240813,354.86,3.5162121377315154,11048.0
299,UCx8vbgWs666cAS7wsKos5sA,8-BitRyan,2015-03-18,"Welcome to my channel, my name is Ryan! You can expect to see a variety of gaming content based around just about every genre out there! If this is your thing, ...",Gaming,1394865,1519.4607843137255,918,360476377,258.4310144709345,392675.7919389978,2067.22,0.8119399360670472,1.0,95.04,0.03584654043652831,-0.1338985448915191,12641.38,4.826446844915404,280029.06
300,UCbShavGeOHnfiKn2qsYSv2A,LachlanPlayz - Gaming & Lets Plays!,2014-11-21,"Hey guys it's Lachlan Here with my 2nd Channel on Youtube! This is where I will post all of my gaming content that isn't Minecraft, I hope you enjoy the videos ...",Gaming,681309,1227.5837837837837,555,87096486,127.83698145775264,156930.6054054054,424.22,0.39289617412317246,2.1,55.6,0.05168007517269054,0.46233290874093946,4126.22,4.359114825342721,107027.9
301,UCB4GZzsP0IJKWX8-IhEOnDQ,Jeremy - Gaming Curios,2012-07-06,"League of Legends - Jeremy ""Gaming Curios"" - Video Essays Covering Topics Primarily Related To League of Legends, as well as other information videos ...",Gaming,529085,659.706982543641,802,173095085,327.15931277582996,215829.283042394,393.78,0.3064654829263908,5.8,323.42,0.16608227843742157,0.012113941474526399,2165.7,1.6829879120468239,171725.16
302,UCiZVMOinTQGb8HQu53VbV4Q,Gamer's Little Playground,2009-12-29,MERCHANDISE: shop.spreadshirt.com/gamerslittleplayground/ Stop playing. Start gaming. Home of the Game Movie. The Netflix for Gamers. Any donations are ...,Gaming,958097,372.51049766718506,2572,485580246,506.8174161906362,188794.80793157077,140.24,0.4420444957853884,0.2,26.06,0.08452704068397131,-65.11807494210264,647.28,2.2932667820233235,53656.02
303,UC-zjH-e5XBzMpy_VtwIGRxQ,Arekkz Gaming,2013-01-12,"The best Channel for Destiny 2, Monster Hunter World, The Division & More. Arekkz Gaming is a YouTube gaming channel dedicated to covering all games, with ...",Gaming,780742,283.596803487105,2753,202356687,259.18509187414026,73504.0635670178,494.44,0.5110860886837603,1.0,58.1,0.08058474374752606,-1.235603158056019,2817.86,2.771512413295068,113401.12
304,UCgiJxU4CSEjQ67FylcZ_8qw,VERTiiGO GAMING,2013-09-08,"My Name is Brendon and i love gaming so decided i would start uploading some of my gameplays, I play everything from RTS to FPS to MMO to Sports so i will ...",Gaming,417862,624.6068759342302,669,71187164,170.36046350230458,106408.3168908819,849.92,0.9222403352462253,4.3,111.4,0.12327715822771741,0.009436305387275608,4751.78,4.869533325526399,104188.28
305,UCB-UY_HpZgYMfkYi2Xxs-lA,Zueljin Gaming,2011-11-28,"I'm Zueljin! A gamer, content creator, & influencer! Zueljin Gaming is a channel dedicated to games of all types. Daily video uploads of new and upcoming ...",Gaming,303382,84.17924528301887,3604,57224865,188.62313848547376,15878.153440621532,15.0,0.4265884874517882,0.4,3.1,0.10767561138165284,-3.788035863781762,179.9,4.816094450384595,3979.18
306,UCv_hGnLMl_l4YfDEpwCaOGQ,Fed X Gaming,2009-05-18,Hello everyone Fed X Gaming here! I hope you like tutorials! Twitter - https://twitter.com/FedEx2692 Facebook - https://www.facebook.com/fedex.gaming?fref=ts...,Gaming,1089173,949.5841325196164,1147,226094216,207.58338298874466,197117.8866608544,490.98,0.5023902697721497,6.4,107.54,0.07114446489870332,-0.23422118303990347,2712.94,2.0966477547027145,175723.54
307,UCPYKRT-XpEfLsajbB2Nd7Og,SPACE GAMING,2012-08-30,"Von den Machern von ""Space Frogs Entertainment"" und ""Space Frogs Radio"" kommt jetzt die Innovation schlechthin... ein Let's Play Kanal! Nur irgendwie ...",Gaming,217334,1738.672,125,20598312,94.77721847478996,164786.496,487.7,0.23916955640859988,11.8,109.44,0.06124949695485345,-0.7627542343430185,8951.78,5.484689827672998,176789.34
308,UC2vUKoTGIwNYq4LO0YWKPIg,HappyConsoleGamer,2008-03-17,Retro gaming fun! SUBSCRIBE! Please enjoy! Support us on Patreon! https://www.patreon.com/happyconsolegamer I'm your host Johnny Millenium and I ...,Gaming,173388,233.9919028340081,741,31954544,184.295014649226,43123.54116059379,511.5,1.5198990240971566,2.8,64.56,0.17287974883711238,-0.2534972094225351,1889.42,5.564696212449602,36608.56
309,UC-S7xonqgsyX5DyjI83uIQg,Steparu.com Gaming News and Previews,2010-02-08,"Foreign Gaming Reviews, News, Media, and Information. 외국게임 리뷰, 뉴스, 영상, 정보 http://steparu.com/ https://www.facebook.com/Steparus/ Copyright ...",Gaming,151732,46.94678217821782,3232,104283733,687.2889897978014,32266.00649752475,63.74,0.4713280913551462,1.0,12.76,0.1007325217483141,-2.566661600722662,304.7,1.6544197560264997,16913.9
310,UCbT28Wqt-dJtC0Dxa8UI_xw,Mystical Gaming,2011-01-09,Welcome to my multiplayer focused channel. I made this channel a few years back to store my gameplay for personal viewing. I sure didn't expect it to grow as ...,Gaming,3868,0.28018833755885547,13805,1787610,462.1535677352637,129.49003984063745,0.9,1.5952514398430417,0.2,0.12,0.34370255348516215,-4.095555165026925,3.44,6.421286581258073,58.9
311,UC8Udz9i3cflPNE6XvnL_tHw,Red's 3rd Dimension Gaming,2010-12-31,Welcome to my Gaming Channel! My favorite Video Game Genres are Role-Playing Games [RPGs and JRPGs] and Horror. My Channel mainly consists of ...,Gaming,59868,6.812471552116523,8788,46319637,773.6960813790339,5270.782544378698,9.24,1.008750608914121,1.1,0.54,0.08138774270170951,4.930991726506974,33.98,4.05494306750881,926.74
312,UCBnFNKtql_q0WjrHF7RPEOA,YourGibs Gaming,2011-02-22,"YourGibs Gaming! | Machinima YouTube Partner | Commentator | Offering Let's Play, walkthroughs, commentary and gameplay of your favorite video games ...",Gaming,20215,2.396846099122599,8434,15862976,784.7131338115261,1880.8366137064263,2.78,1.7991059384982906,0.5,0.12,0.032829588070087165,-2.925354021679904,8.38,4.4143413931656825,244.02
313,UC8_zCExQ9M7UI_3Aw8Kcnzw,Dad's Gaming Addiction,2012-07-12,"Dad's Gaming Addiction is a website devoted to gaming news, previews, and reviews. PC Specs: Windows 10, Intel Core i7-6800k CPU @ 3.4 GHz, GeForce ...",Gaming,30276,4.2385552288954225,7143,14532493,480.00042938300965,2034.5083298334034,3.04,1.997692473875005,0.2,0.0,0.0,-6.814080955246007,0.0,0.0,175.54
314,UCY_wPnc5xrvPekvHpLAvZvQ,Sports Gaming Universe,2011-04-26,Sports Gaming Universe is all about combining the sports and gaming passions into a one stop shop experience for fans alike. From Vintage sports games on ...,Gaming,206852,29.191645498165396,7086,99332402,480.210014889873,14018.120519333897,3.4,0.3687004463127989,0.3,1.12,0.10121782870541253,-3.467088837296733,32.2,3.111679324365579,1332.8
315,UCjmKdx8yjoYIVxRnsSyPw7w,CYCHREUS GAMING,2007-12-24,Paypal Donation Link https://streamlabs.com/cychreusgaming MAIL BAG is now active! You can send me your lego sets or any other video game item ...,Gaming,64786,10.364101743721005,6251,131365054,2027.676565924737,21015.046232602785,9.14,0.9280229712567298,0.5,6.22,0.6124808930767027,-0.23517448290604334,24.2,6.344366635205192,1655.58
316,UCAIGJn8wLYm5IddQ0E7Qliw,iOS Gaming World,2013-10-07,The only place to be for all your iOS App needs with direct itunes links straight from your iPhone & iPad with just a touch of a button. - Please subscribe and also ...,Gaming,2015,0.32385085181613626,6222,1562350,775.3598014888338,251.10093217614914,0.06,0.021739130434782608,0.1,0.06,0.04835543258307486,33.581798781444306,1.48,2.27003534288685,155.3
317,UCnSuI6Qe57RSyIXn2Q-2Emg,Serious Gaming,2011-10-17,A channel for gaming walkthroughs and let's plays in an intelligent manner. Check the Master List for links to individual playthroughs Location: Romania ...,Gaming,23987,4.04025602155971,5937,14891490,620.8150248051028,2508.2516422435574,1.3,0.7777191182160951,0.3,0.16,0.0925316025646793,-7.024711455490006,6.74,4.605146174904736,152.86
318,UCUQImyo-lipLg2Yr3KQEnTQ,Bersys & Gaming Madness,2011-04-14,Всем доброго дня и хорошего настроения! :) Канал не является проектом и не имеет конкретного направления....,Gaming,8435,1.8167133318974802,4643,3694660,438.0154119739182,795.7484385095843,0.82,0.35240992301560503,1.7,0.54,0.302611405611585,0.4409608071700862,20.86,12.122200439682315,189.86
319,UCF6xAMHVH3o3rhpAjgQt3XA,Dave's Gaming,2009-09-09,Oldest Video game Player On youtube at age of 55 years Old Why I Love Gaming? 1-Best HD quality on Youtube. I use Latest and Best recording Tools.,Gaming,125571,29.805601708995965,4213,129310873,1029.7829355504057,30693.300023736054,1.18,0.20753865322820003,0.2,1.36,0.14744312354607714,0.5508386757207904,14.98,2.05652427591925,1363.66
320,UCfYQJa2qGuCy6z87UBHhA8A,Smash GaminG!! - Frazzz,2012-11-27,"At Smash GaminG, the aim is to bring you great, fun content on a regular basis. From Co-op & Solo Playthroughs plus weekly shows with tons of fun to be had !",Gaming,31552,8.079897567221511,3905,7897212,250.29196247464503,2022.3334186939821,6.16,0.8001524633190179,0.4,1.5,0.1436884771519237,-2.0452143491641577,31.52,3.2007012653625724,1079.42
321,UCRu57V-oKAkQs4fx76dzIkw,Sheepdog Gaming,2007-04-10,"Welcome to Sheepdog Gaming, I am Sheepdog and I love gaming, although I am usually at best, an average gamer. More than anything else, I enjoy ...",Gaming,26217,7.009893048128342,3740,6043292,230.51043216233742,1615.8534759358288,2.06,2.4393382035434055,0.2,0.16,0.10934636133680029,0.3784372803491659,5.76,6.7886137803493,117.46
322,UC5S0zPiz9-zZJ6WTV3YfE9w,Dave Gaming,2014-10-17,"Willkommen! Hier findet ihr alles, was das Gamerherz begehrt. 23 Jahre alt und seit fast 20 Jahren leidenschaftlicher Gamer! AKTUELL: - GOD OF WAR - F1 ...",Gaming,73681,20.314585056520542,3627,25826484,350.51755540777134,7120.618693134822,11.5,0.4792518427832925,0.3,3.66,0.0857207144877132,11.030847186582605,174.94,5.041179667284504,3609.36
323,UCHJFAuEQJm74w5_aI033sWg,999 Gaming,2014-09-18,"The latest news for The Walking Dead, The Walking Dead Spoilers and Hidden Clues, The Walking Dead Game Play, The Walking Dead Road to Survival, The ...",Gaming,71101,19.799777220829853,3591,30827098,433.56771353426814,8584.544138123085,39.92,1.314893971889467,1.0,9.42,0.2864739160103904,-1.2440205162774987,204.76,7.719086022428242,3601.02
324,UCDxu8BHRAB0ZTZUuaj_lM8w,AnGeLuS Gaming,2014-07-16,"Moin moin, ich bin der AnGeLuS aus Hamburg und ich möchte euch hier mit niveauvollen, informativen Videos und Let's Plays unterhalten. Let's Plays mit Herz ...",Gaming,19825,5.813782991202346,3410,5131161,258.82274905422446,1504.7392961876833,11.16,3.9067644428279062,0.3,0.82,0.18154842209063152,-3.0082047814853143,39.22,12.363904260543492,414.56
325,UCkLjx8J7vOfaodZNN2h77Vw,EMK GL Gaming Hub ™,2006-06-19,"Canal dedicado a los amantes de Video Juegos y Retro Gaming: Transmitimos Eventos de Gears Of War, Campañas de juegos actuales y retros, tops y muchos ...",Gaming,57508,17.575794621026894,3272,9444893,164.23615844752035,2886.580990220049,6.36,0.79032141189225,0.7,8.0,0.8409827426975423,-0.7154678013055786,88.64,7.048293574437352,1135.58
326,UCHIV9ce1kI9WlubQJ_53_Kg,Gaming Spite,2014-04-08,"Riseofasolja is my psn. This channel is dedicated to Walkthroughs,How to's,Top 10s,and last but not least Tips and Tricks, I'll also be uploading toy unboxings in ...",Gaming,27187,8.4959375,3200,18526469,681.4458748666642,5789.5215625,0.26,1.0730193387398628,0.5,0.0,0.0,0.835032669188426,0.76,3.1985464799873764,20.18
327,UCobP8-RBCEPh4Bzsm02BNFQ,Dalaran Gaming,2012-01-03,"My channel and videos are mostly about Rogue Content, this includes Guides, Arenas, Battlegrounds, Commentaries, Patch Updates, and anything else that ...",Gaming,64502,20.80709677419355,3100,27805564,431.080648662057,8969.536774193548,33.94,0.4070422312276791,0.4,14.68,0.21460546952177614,-2.723279406327273,118.98,1.642301863763894,9529.72
328,UCx1HjzyQkomnucs12VfNaiA,Gaming Blog,2011-10-10,Cause I'm Addicted to gaming! I Upload everyday so subscribe today!,Gaming,3614,1.16920090585571,3091,1533042,424.19535141117876,495.9695891297315,0.18,1.0916680794407525,1.0,0.08,0.12114029790660223,16.878956118151713,4.72,8.831467196740558,50.46
329,UC5I3vUh2iNfQ3pCU3sodYRA,Amazing Gaming Music,2012-09-03,Amazing Gaming Music is promo channel. Amazing Gaming Music is the vibes music. we promo and trend music edm.. If YOU OWN label record ( we need all ...,Gaming,387010,137.33498935415187,2818,45728358,118.1580786026201,16227.238466997871,6.72,0.26317691406407795,0.2,5.26,0.21998594382390937,-3.600625925299971,171.02,7.044206489049083,2462.76
330,UCTjOuSqjBe8fdENsjFHjszw,ToiletPaper Gaming Channel,2015-09-27,おじさんが四苦八苦しながら遊んだゲームのプレイ動画をUPします。 主にストーリーメイン、高難易度攻略プレイは致しません。 メジャータイト...,Gaming,3625,1.3205828779599271,2745,1804622,497.82675862068965,657.4214936247723,2.56,1.701549517172275,0.3,0.0,0.0,-2.0317765029145973,0.0,0.0,161.66
331,UCc9CTSbRSrQoFnA1lgVCCuA,TheGameHuntah Gaming,2012-05-13,"The BEST Mobile Gaming channel on Youtube ! In here you will find family friendly content and tons of Mobile games (iOS, Android and Windows) Some of the ...",Gaming,107375,43.934124386252044,2444,55639665,518.1808149010477,22765.82037643208,27.22,0.7738729622539035,1.9,10.62,0.16061641710696398,-12.379441902178964,131.38,2.421218820152535,12921.44
332,UC3OTkeJACC6daAmHGK-z8ag,GU | Gaming-Universe,2010-01-13,Auf dem YouTube-Channel von Gaming-Universe findet ihr die neusten Videos aus der Welt der Videospiele.,Gaming,838,0.34671079851055026,2417,2412099,2878.3997613365154,997.9722796855606,0.02,0.00823045267489712,26.4,0.18,0.11491910874133335,0.025202212075109254,1.86,1.8676770538915735,160.0
333,UCKEJZ-dqIA03evnzEy1_owg,Welsknight Gaming,2014-09-15,"Hermitcraft Member, Husband, Soldier. Creating family-friendly gaming content since September 2014. When it comes to Minecraft, I do modded and vanilla ...",Gaming,279773,115.80008278145695,2416,56958811,203.58937781701593,23575.666804635763,192.62,0.8942688919969746,0.8,21.62,0.09553203645980857,1.401399445375758,1113.7,4.855085954442286,24437.94
334,UC_dkX2_MJZeiYZImFN8AOvg,Most Valuable Gaming,2014-03-30,High Production Competitive Gaming. Informative & Fun Casual Gaming. And the story between the lines. Find. Your. Place.,Gaming,59820,25.368956743002546,2358,28827987,481.912186559679,12225.60941475827,61.18,0.6086273808666992,1.6,27.16,0.41289600992730907,7.641282760932196,269.08,2.324320780637466,10230.38
335,UCoMloO7Xla-QyPPsTKsN_Lw,HappyThumbsGaming,2011-10-07,Welcome to Happy Thumbs Gaming(HTG)☺ Where Gaming is Fun and Thumbs are Happy. Our goal is to make HD quality videos that are easy to follow and ...,Gaming,86774,36.87802804929877,2353,35352840,407.4128195081476,15024.581385465362,4.2,0.8374799528837021,1.0,0.74,0.1328736273524962,-1.2166714669196332,22.8,5.3396269902728815,509.96
336,UC07JpCn-IUv4KnJUjRba9Wg,Dosgamert,2014-07-09,Nostalgic value for retrogamers in the Highest HD quality you can find on Youtube! All in 1080p and 60fps! // Facebook // -- http://facebook.com/Dosgamert ...,Gaming,3062,1.3418054338299736,2282,1340141,437.6685173089484,587.2659947414548,2.36,1.4843001667366118,2.9,0.12,0.07113158842760754,-0.10417742793930662,12.24,8.092124408520775,168.94
337,UCSP56LfB8a-tfcdKKOwSMfw,JNR-SNR Gaming,2014-05-19,Welcome to Junior Senior Gaming. We are a gaming channel that focuses on vehicle simulation. We have new videos everyday and we stream every day at ...,Gaming,16779,7.375384615384616,2275,4145276,247.05143333929317,1822.0993406593407,20.0,1.5276075604525914,1.5,2.74,0.19094444879419661,0.3024018068486152,58.2,4.901898053582128,1404.34
338,UCYm4fCA4VzGuY-JdZXG7jqg,Jason Rides Llamas,2009-04-26,"LIVE STREAM SCHEDULE! ◅◅◅ Monday through Friday evenings at 6:00 pm Eastern Time If it's your first time here and you've come with ill intent, I highly ...",Gaming,9307,4.158623771224307,2238,1595950,171.47845707531965,713.1143878462914,5.0,2.3430362876873128,1.4,15.4,8.320123984765335,0.07058138853667102,7.68,4.261750528556469,195.18
339,UCNoLwxiLiQIKX2Lk0WuTgkw,Pravus Gaming,2012-04-22,New content available every weekday with a strong focus on strategy games or anything with a good story. Videos can range from silly and whimsical to ...,Gaming,147441,65.00925925925925,2268,34979986,237.2473463961856,15423.274250440918,75.26,0.5959152376964535,0.6,4.84,0.03949896654517902,-3.4611519988559505,561.1,4.351744706492303,13851.22
341,UCRSvEADlY-caz3sfDNwvR1A,Huda Beauty,2007-01-14,"Hey My Loves!! Thanks for visiting :) I'm Huda, the Founder and CEO of Huda Beauty! For me, makeup has always been so much more than a way to look more ...",Beauty,2324318,7773.638795986622,299,128589970,55.323742276228984,430066.7892976589,863.76,0.22133648551971208,14.3,480.08,0.10845567181306302,-0.08652885878058672,12755.1,2.9537804956956784,512019.22
342,UCB0d0JLn1WcGYcwwZ87d2LA,Rclbeauty101,2010-12-14,"I make different types of videos ranging from, DIYs, life hacks, comedy, skits, and anything I enjoy making, I hope you enjoy it too! For all business and branding ...",Beauty,13274330,35304.06914893617,376,2868606612,216.1018003921855,7629272.904255319,5189.54,0.2866640373269097,5.2,2191.36,0.08418465373168857,-0.04906021707693625,53217.34,2.532808181175297,3003914.18
