,Channel ID,Channel Name,Created,Description,Genre,Subscriber Count,Subscriber/Video,Video Count,View Count,Views/Subscriber,Views/Video,Comments/Upload,Comments/View,Days/Upload,Dislikes/Upload,Dislikes/View,Growth Rate,Likes/Upload,Likes/View,Views/Upload
482,UCt_x7Lrzsh46ldekqW4b3hw,Art and Fashion,2016-03-27,"Highlights from the greatest designers and models on the runway, exemplifying artistic expression through fashion.",Fashion,26444,614.9767441860465,43,11361928,429.6599606716079,264230.88372093026,11.44186046511628,0.005523011251159129,4.2,65.3953488372093,0.023837295282634962,-7.225331787229069,535.6511627906976,0.2742424529336795,264296.37209302327
483,UCVmPyrwjL0wepDhmvgzlOcA,The Fashion Archive,2018-01-11,Documentation On Anything Fashion & Entertainment.,Fashion,350,10.294117647058824,34,7703,22.00857142857143,226.55882352941177,8.0,4.125405228389865,3.2,0.36363636363636365,0.1151718568869,-2.7523344923096955,12.727272727272727,6.792863548663683,232.0909090909091
484,UCgWfS_47YPVbKx5EK4FLm4A,Jenn Im,2010-03-01,"Business Inquiries: jenn@rare.global I'm Jenn Im. Korean American. Born and raised in LA. Clothes Encounters is a vlog of style musings, tutorials and lifestyle ...",Fashion,2167844,3850.5222024866785,563,219586427,101.29254088393814,390029.17761989345,775.38,0.28471619722552416,4.2,217.16,0.08252843987048408,-0.46667939064312747,12331.98,4.338705589718415,294157.5
485,UCe1qICvWRDbdH7-Fixvj7Bg,The Business of Fashion,2009-01-03,"The Business of Fashion has built a global following as an essential daily resource for fashion creatives, business professionals and entrepreneurs all over the ...",Fashion,56420,205.91240875912408,274,3374715,59.81416164480681,12316.478102189782,5.34,0.12134714554596035,7.4,2.84,0.07980523060429257,-0.32856886084102743,77.52,1.5734478412943689,4875.14
486,UCkHrz5rsB72J4806xIkKeHw,Fashion Trends PK,2016-01-08,"Find out all about the latest fashion trends for you. New Clothing, Shoes, Jewelry, Bangles Beauty Tips, Hair Styles, Mehndi Designs, Bags. Thank you so much ...",Fashion,6527,6.6062753036437245,988,1440727,220.73341504519686,1458.2257085020242,0.32,0.09138434347174694,0.3,0.18,0.0807959325002077,13.299797269841454,2.92,1.1079841818470952,348.8
487,UC4eQxlfnAJqG5L4sroekWhQ,Korea Fashion,2017-01-17,Collection of Korean Celebrities fashions // Korean Fashions.,Fashion,1433,11.556451612903226,124,766926,535.1891137473831,6184.887096774193,3.82,0.15413314336847714,5.7,0.72,0.012379777713153756,-0.9187414677604955,43.2,1.375787753423685,4732.72
488,UCuCXXo0FRLq_vFlNz-yLf-A,POPSUGAR Fashion,2010-02-12,POPSUGAR Fashion is the ultimate source for what's new in fashion. Don't forget to check out our show We Spy Style!,Fashion,141867,53.757862826828344,2639,39852409,280.9138770820557,15101.329670329671,23.34,0.10338350880051644,11.7,23.46,0.15876475204293322,0.41715382059509915,240.62,1.5601545837624196,54797.22
489,UCjbjvSq7p22DjFHzTB0UMIw,Fashion Tips,2014-01-10,"Welcome to Fashion Tips, I am Noor, Fashion Designer from Pakistan. You can watch daily free videos on my channel about fashion designing, Cutting, ...",Fashion,116745,543.0,215,9754734,83.55590389310035,45370.85581395349,133.96,2.998309069966941,1.3,12.24,0.1667477056593011,-8.950203623296902,258.82,4.018499715536075,9701.6
490,UCIq58g_1_vGIUQaRqmFT35A,A FASHION,2008-01-25,"With a passion for fashion I create videos to show of some of the top models in the industry, as well as the latest trends and fashion shows. If you have any video ...",Fashion,30523,56.41959334565619,541,7488193,245.32952199980343,13841.391866913124,40.54,0.27550955054425436,4.7,16.68,0.06361321236658883,-0.15676728368589965,477.48,2.0657618862514204,32103.36
491,UCxWQnCW7H0ZMxHbDEOOboyA,CREATIVE FASHION,2013-09-27,"NAMSTE WELCOME to our channel. CREATIVE FASHION is a you tube channel , & i am very glad to meet through this channl who love""s FASHION ...",Fashion,204785,1422.1180555555557,144,16751914,81.80244646824718,116332.73611111111,95.22,0.3314349923749756,3.3,1.06,0.005831368276845688,-0.13265491930152726,28.22,0.1332221660532748,122982.62
492,UCbZG-0SLWjNIP8tqtKEVoNg,ANLYA MODEST,2016-06-26,Let's talk about : M O D E S T   F A S H I O N   I N S P I R A T I O N  & I N T E R S E C T I O N A L I T Y & P O S I T I V I T Y ! Bienvenue !! Welcome!! FRENCH GIRL ...,Fashion,12063,389.1290322580645,31,253627,21.025201027936667,8181.5161290322585,30.516129032258064,0.5345500437443884,14.4,7.483870967741935,0.10389359255651255,-0.11198197332993602,263.61290322580646,3.90868607143841,8185.1612903225805
493,UCf8RUzh59m1XX8NjA3qHjEg,What to Wear - Fashion Over 40,2013-08-19,Welcome to my channel! My name's Gemma. Subscribe to my channel if you enjoy High Street fashion for regular woman over 40. I post videos wearing all the ...,Fashion,7438,135.23636363636365,55,578286,77.7475127722506,10514.290909090909,20.44,0.4092125843883578,7.1,15.48,0.13990448663502714,0.2209744199762918,188.58,3.116172282212658,11357.92
494,UCAYNyC4XsSYszzo2Wj5QiZA,Fashion for Life,2015-09-05,,Fashion,34690,1020.2941176470588,34,10247812,295.4111271259729,301406.23529411765,48.85294117647059,0.017144326736001053,18.6,110.61764705882354,0.04256188248788503,-5.327687624695935,1269.8235294117646,0.5114970062015396,301553.5
495,UCS-HyxHT3A_PLXC8zlX73Yw,Fashion Television,2014-11-10,"Fashion Television is considered the leading authority on fashion and lifestyle. Broadcasting internationally, Fashion Television is a 24-hour English language ...",Fashion,9583,11.340828402366864,845,4257393,444.2651570489408,5038.334911242604,0.0,0.0,1.1,0.04,0.06136363636363636,0.06051918804997348,0.84,1.4459572218246108,47.02
496,UCZA46tF5X7hGLwZQkvdlQlA,Fashion Boys,2017-02-14,Fashion Lifestyle.,Fashion,161,32.2,5,5265,32.701863354037265,1053.0,18.4,1.6994209100424902,14.2,21.6,2.084189525307181,-0.16093388850287826,47.6,4.448982285284272,1052.6
497,UCGaus2Sz1c8nKayvTDkhg9w,Vintage Fashions,2011-08-17,"Vintage Fashions - a dedicated fashion channel from British Pathé, on which we share vintage beauty shows, fabulous catwalk coverage, retro women's lifestyle ...",Fashion,51806,518.06,100,8349347,161.16563718488206,83493.47,44.72,0.09575480125567089,26.1,7.54,0.0147085322785036,-0.26027406323242386,395.86,1.2914670100788503,100406.18
498,UC7gJCoe8Zf4N1aB0Hnmzyqg,Evelina,2008-05-31,"Welcome to my channel! Please subscribe for more fashion, beauty, healthy living, and lifestyle videos! Also, make sure to check out my Russian Channel, too!",Fashion,1325356,4750.379928315412,279,99263743,74.89590947639728,355784.0250896057,505.3,0.25576152131810004,17.1,351.92,0.18692401385769136,-0.09364973250919922,9044.02,4.255042427390015,224355.58
499,UCNnfmMpsHwSo9uN8mID0IVA,Fashion Updates,2017-08-20,Daily world wide news updates.,Fashion,11525,53.35648148148148,216,2891264,250.86889370932755,13385.481481481482,10.46,0.30854267415831627,0.5,6.88,0.0655718526756555,-31.101875452663492,147.08,2.525446727184226,19502.58
501,UCL-mshGEBtQ6GMgFlzR-U8Q,Style and fashion by bassem,2015-10-07,"In this channel you can find many videos around men's style, fashion tips and accessories.",Fashion,2720,8.662420382165605,314,512589,188.4518382352941,1632.4490445859872,0.12,0.054443532901545105,2.5,0.42,0.22675118033944752,-0.18003237869079214,5.16,2.2033840755950806,319.16
502,UCxp5zD09MTmetQZA0TeFbXg,South India Fashion,2013-04-28,www.Southindiafashion.com is a fashion blog for style-conscious women everywhere. It is the ultimate spot for the fashion obsessed which features celebrity ...,Fashion,5321,190.03571428571428,28,2009482,377.65119338470214,71767.21428571429,2.0357142857142856,0.0020406563148635294,40.2,16.964285714285715,0.030124802610332034,-0.028935388804332697,92.10714285714286,0.2671154976980668,71901.75
503,UChpCpZeauJUdpZXDTwwi64g,Fashion Bloggers TV,2015-06-09,,Fashion,9469,430.40909090909093,22,379590,40.08765445136762,17254.090909090908,5.7727272727272725,0.036946446831060166,2.9,6.318181818181818,100.72104052617215,-0.9068425423808304,92.36363636363636,8.399626991360632,17253.272727272728
504,UCrE3DFHrxY0Cp9KM8BuEX4g,Fashion Laura,2013-12-24,Kopiowanie i wykorzystywanie filmu bez zgody autora jest zabronione.,Fashion,87025,503.0346820809249,173,13938835,160.1704682562482,80571.30057803469,639.16,1.3054431244078875,6.2,618.84,1.3277760137259178,0.23527462689653078,2125.74,4.297360395730459,55526.06
507,UCLjEhcwJtxVUXMtOxisK69w,JTO Fashion,2015-09-09,"Founded in 2014 by Temi Otedola, JTO is far from just a fashion blog. Motivated from her own inspirations, Temi has used JTO as a platform to express her ...",Fashion,10346,181.50877192982455,57,542241,52.410690121786196,9513.0,33.4,0.31454904629637326,16.2,5.4,0.0418509872772803,0.1281573900911504,267.02,2.594104618754536,10584.12
508,UCUUUpaMp8DV6KUOfQwoIiLg,WOWPresents,2010-03-10,"WOWPresents is edgy, loud, ahead of the curve, fashion, music, celebrity, trendsetting, off-beat, in drag, out of drag, gay, straight and whatever. WOWPresents is ...",Fashion,987389,349.8897944720057,2822,605087158,612.8153726646742,214417.84479092842,362.9,0.5384703360339697,0.6,96.46,0.25284914494851707,1.7616038241595835,2272.68,3.1924994515496046,80081.88
509,UC0KiGuCTrehqzSQ7ikjxSQw,Patricia Bright,2009-02-21,"A Female fashion beauty and hair channel with tutorials and videos to help with your beauty and fashion needs. Style advice Im here, random Life advice I'm ...",Fashion,2314237,3714.666131621188,623,197241679,85.22968001980783,316599.8057784912,2905.1,0.3916632447563042,3.4,473.86,0.06273423533872743,-0.2786030117398653,33719.02,4.5955371584717515,765140.28
510,UCRXiA3h1no_PFkb1JCP0yMA,Vogue,2008-06-29,"Vogue places fashion in the context of culture and the world we live in—how we dress, live and socialize; what we eat, listen to and watch; who leads and ...",Fashion,2507614,1256.949373433584,1995,558719781,222.8093243218454,280060.04060150374,1392.62,0.1799396900060823,0.8,506.86,0.06091576050540663,-5.112755400669322,30720.78,4.086849287942019,682910.18
511,UC_KQKeg7kNrlvrIXPnpwgEA,Dina Tokio,2011-04-04,"Modest fashion, Beauty & Lifestyle PO BOX address for mail is below: Suite 220 45 Salisbury Rd Cardiff CF24 4AB.",Fashion,757100,1561.0309278350514,485,104705366,138.29793422269185,215887.3525773196,826.94,0.334304458885204,4.6,335.72,0.1136961277133195,-0.015492739637498903,9036.86,4.0402163417782,228524.16
512,UCZpNX5RWFt1lx_pYMVq8-9g,Chriselle Lim,2008-01-26,"Notable for her visually stunning original content, Chriselle Lim has created a name for herself in the fashion industry. Starting off her career as a stylist, she ...",Fashion,758959,1966.2150259067357,386,66847818,88.0782993547741,173180.8756476684,143.02,0.29296679736846865,5.9,77.52,0.11544425713813919,-0.09565990671902085,1946.9,3.0992605132406643,64551.14
513,UCRSfmNCRk58D-aL5vZdBLow,Wendy's Lookbook,2011-01-13,"Inspiration. Imagination. Fashion. Hi everyone! I'm Wendy. I find inspiration in art, nature, culture, architecture, food, people and music. For me, fashion is a ...",Fashion,666102,5286.523809523809,126,90115675,135.28810152198912,715203.7698412698,756.08,0.3081263400430203,40.9,123.36,0.07864190091673,-0.02429316334408027,7304.02,3.047156397554127,278126.54
514,UCoSjnRDZSFVp88NXE7MenLQ,Lydia Elise Millen,2011-02-02,"Lydiaelisemillen.com is a Fashion & Lifestyle blog from Buckinghamshire, UK.",Fashion,620446,2068.153333333333,300,68812573,110.9082385896597,229375.24333333335,674.64,0.2351676038873205,3.3,385.2,0.14962626601670762,0.08693310765319023,7686.94,2.67179175004626,277256.46
515,UCj5tYok-Han88RBzumyHwlw,Elegant Fashion 360,2013-04-24,"Welcome to my channel Here you can find all the fun thing to do, to make, and to eat. Check out my web site www.ElegantFashion360.com for more Fun Ideas.",Fashion,247454,516.6054279749478,479,93316624,377.106953211506,194815.49895615867,49.44,0.20706285439630964,21.4,59.08,0.13218055065663442,0.1111244680590633,631.92,1.2320955440381431,64928.18
516,UCoc8tpGCY1wrp8pV7mI0scA,H&M,2007-03-07,Welcome to H&M's official YouTube page. Explore the entire H&M fashion world under one roof. Subscribe to get all the latest video updates and fashion news.,Fashion,311735,617.2970297029703,505,170540020,547.0672847129773,337703.0099009901,0.0,0.0,8.0,209.74,0.14915641060796372,24.750142176577096,1085.16,1.1932017459685842,1313005.58
517,UCZ8TREbPfawhSvayVe5pqKg,British Vogue,2005-10-05,British Vogue is the world's leading premium lifestyle and fashion entertainment channel. Weekly releases and brand new original programming including short ...,Fashion,534215,2273.255319148936,235,72285378,135.31139709667457,307597.35319148935,94.0,0.16091808859653203,3.7,48.82,0.08973802676434668,-1.087071651714593,2071.46,3.6442169248357232,77199.28
518,UCSvZTE-ZDWdgkmz9kwiYDRQ,Tokyo Fashion,2009-05-27,"The official YouTube channel of TokyoFashion.com, the world's most popular English-language website about Japanese street fashion and beauty. Please ...",Fashion,161649,557.4103448275862,290,17819493,110.23571441827664,61446.527586206896,106.04,0.257999973041512,25.5,31.96,0.0777311042969621,-0.014557923855891736,1560.26,4.311882548303739,68046.94
519,UCuduuoIBTPTyE9Jzs30kt5g,Fashion-Riot,2012-12-12,Fashion-Riot es un canal de moda y consejos. Contacto: clarita@fashion-riot.com.,Fashion,599816,5261.543859649123,114,29372398,48.969013830908146,257652.61403508772,191.82,0.3075157799199081,15.2,131.22,0.21705001278299724,-0.33612355329711624,3023.86,4.067718355068346,79053.72
520,UCIqxFPHOuIyuLIgEWZTidCQ,Mercedes-Benz Fashion Week,2007-08-14,"The Official Mercedes-Benz Fashion Week YouTube channel is your front row seat to the iconic New York, Berlin, Australia, Istanbul and Miami shows.",Fashion,46747,17.720621683093253,2638,19077760,408.1066164673669,7231.902956785443,1.0,0.04486370956595823,1.1,2.18,0.08461512409068749,-3.1630450832960197,16.14,0.8611600953800487,3027.6
521,UCx_oBUq0abZhe3OUMRTqdLg,"Stardoll Fame, Fashion & Friends",2006-05-17,"Stardoll is a world of Fame, Fashion & Friends. Create, style and dress up your own virtual doll in the largest and most popular online fashion game. With over ...",Fashion,395616,540.4590163934427,732,7576835,19.15199334708404,10350.867486338799,19.5,0.5632621542855624,9.4,5.74,0.15570414528719062,-0.0895829991416728,85.66,2.2777231006900194,4194.42
522,UCCVKEfCwVZO60HhdhcN56HA,Sophie Shohet | Fashion Beauty Lifestyle,2009-03-21,"My favourite topics: Luxury, Supercars & Personal Development Here's a little about me and what my channel is about.... I'm all about personal development and ...",Fashion,177246,624.1056338028169,284,19811536,111.774234679485,69758.92957746479,225.16,0.5567813092642983,3.3,45.56,0.10983808634367247,-0.04668134245589588,1568.76,3.9271261534761397,42525.4
523,UCdQetYa9JdPGTbR5glPiJ7Q,Madda.fashion,2008-10-14,"CONTATTI************ BUSINESS / MARKETING MAIL: Maddinafashionconcorsi@gmail.com ************************************** Ciao, mi chiamo Maddalena, ...",Fashion,81530,109.14323962516734,747,18720563,229.61563841530725,25060.994645247658,66.14,2.0072379745771767,4.6,8.42,0.19196864519222998,1.3039941951747565,183.06,4.8972973038578225,5261.98
524,UCCAcsHKpVHnPB8YhqFV8OuQ,K3chocolate,2008-03-28,"Subscribe for fitness, dance and makeup tutorials, fashion try-on hauls, diet and health tips, relationship advice and more ❤   SHOP my perfume & my merch on ...",Fashion,152244,153.62663975782039,991,25796711,169.44320301621082,26030.989909182645,17.98,0.7805729110590123,5.2,11.5,0.3187467500634446,-2.3963542157725883,99.64,3.037071379644573,13226.88
525,UCse1JOd6PXeLG2lH-m1F2DA,fame fashion,2013-09-25,"If you love engaging in fashion, make-up, beauty, accessories, styling then come around the world with Fame Fashion and discover the latest trending fashion ...",Fashion,105240,267.10659898477155,394,29518948,280.491714177119,74921.18781725888,0.7,0.10082100948080794,0.9,5.26,0.3404981754063465,14.363555746810011,6.32,0.7207143540680605,1544.88
526,UCNe161YMUykW264kFe5PWxA,Highsnobiety,2006-03-31,"Welcome to the official TV channel of Highsnobiety.com, Your Online magazine covering the latest in men's fashion, sneakers, music, art and lifestyle.",Fashion,253352,247.65591397849462,1023,67093556,264.82347090214404,65585.09872922776,54.56,0.23933090539877347,1.9,34.44,0.16317460325514868,-4.329457201092594,603.22,2.142929741781861,38736.3
527,UCZ5WhTJbuTHdwzx-czvNSFQ,Fashion One,2006-09-05,"Fashion One is a cutting-edge, global TV network which focuses on the synergy between fashion, film and TV. The channel features a unique selection of ...",Fashion,31984,21.861927546138073,1463,4141632,129.49074537268635,2830.9172932330825,0.06,0.035048155978388534,1.0,0.1,0.24187167937167936,-2.4600250852513796,1.92,1.7655339126649583,109.34
528,UCK-l8DE1lyZnguaRQr7_Y-Q,Sejal Kumar,2012-08-14,Hi everyone! I'm Sejal Kumar from Delhi. I create Fashion and Lifestyle videos and throw in some bits about my life. I hope you enjoy them as much as I do ...,Fashion,643243,2048.544585987261,314,73874896,114.84757082471165,235270.3694267516,1228.32,0.4369633013201533,3.7,616.94,0.2022276432316966,-0.19888319313996922,14440.9,4.9403444566546675,302737.12
529,UCMUDQ9olA7guLDYE-xNfiHA,Fashion & Lifestyle – powered by OTTO,2005-11-15,"Willkommen auf dem Fashion-Channel von OTTO! Abonniert den Kanal, um kein refashion-Video von Eylem und keine Folge Stylediaries mit Sofia zu ...",Fashion,37887,114.80909090909091,330,14246513,376.0264206719983,43171.25151515152,11.68,0.07348398661367202,4.8,29.8,0.09573089067674494,-5.090412826032631,111.08,0.5238408622645907,80251.16
530,UCxDGBROh_raLb2hmGpnpwSw,My fashion for legs,2015-05-05,"Achtung: Ich bin 2 Wochen gesperrt und kann keine Videos hochladen! Vielen Dank an den Neider, ich habe wohl etwas richtig gemacht ;-) ******* Alles über ...",Fashion,32560,383.05882352941177,85,11134727,341.975644963145,130996.78823529412,70.84,0.11314959648022452,14.3,39.86,0.05130170746133395,-0.4054197123089722,454.02,0.5751951988455233,115792.28
531,UChxkFSjTE7nLCHsDk8_pRhg,Justine Leconte officiel,2015-06-01,"Welcome here! I am a French fashion designer currently living in Berlin, where I founded my womenswear label. New videos every WEDNESDAY 4pm ...",Fashion,362354,2001.9558011049724,181,28053884,77.42120688608378,154993.83425414364,635.26,0.8319840486292396,4.5,60.7,0.071478205780679,-0.15195189043057233,6773.14,8.308204448907924,90040.98
532,UCj2_fTRSMGqo1KmOpmpaOzg,You Make Fashion,2011-02-09,"youMAKEfashion est un blog où je partage mes looks, mes Do It Yourself, mes bonnes adresses et mes voyages. Ma chaîne Youtube complète mon blog avec ...",Fashion,92208,232.84848484848484,396,8026976,87.05292382439701,20270.141414141413,88.72,0.2793828812700418,5.5,30.34,0.0977664372233376,-0.1995065029694096,1444.54,4.513445258906577,34431.76
533,UCtJiRqiTLjCuouJC2Ho-5Mw,Megan Ellaby,2013-01-30,A channel by a fashion loving Mancunian weirdo.,Fashion,84288,384.8767123287671,219,6203635,73.60045320804859,28327.100456621003,94.7,0.27932359033709064,3.4,24.74,0.07239061668234477,-0.13179770339158658,1290.66,3.909373209842925,32603.08
534,UCDUpIWGzLpf_oyQaM6tXJVg,POPPORY FASHION BLOG,2011-07-24,Poppory Fashion Blog รวบรวมนำเสนอคลิปวิดีโอแฟชั่นโชว์ในเมืองไทยจากแบรนด์ต่างๆ...,Fashion,62459,56.729336966394186,1101,32612632,522.1446388831073,29620.919164396004,14.26,0.12571975291558093,0.8,2.4,0.04781073870702119,-1.237103836633585,80.84,1.6660348542054348,6623.46
535,UCDLOWU51V3yuDj7Du3Jypiw,TOR Fashion,2013-03-23,TOR Fashion is a visual database and character gallery for Star Wars: The Old Republic (SWTOR). Videos on this channel are intended to augment posts on ...,Fashion,1988,1.0205338809034907,1948,2849414,1433.3068410462777,1462.7381930184804,1.54,0.25181796023305375,2.5,0.16,0.04142845100523263,-0.189398117771694,5.14,1.0055496944434432,669.3
536,UC3gOnktm2IgFZYzdf-90iEQ,Videofashion,2007-11-08,"Videofashion has been celebrating the art of fashion since 1976! For 41 years, our video crews have been front row, backstage, and behind-the-scenes covering ...",Fashion,23701,8.876779026217228,2670,10506822,443.307117843129,3935.1393258426965,0.48,0.13783615284049505,2.1,0.38,0.09738650659352456,-15.221277858121576,8.46,2.0409113589520187,603.02
537,UCPegzUNwooyJ7fwK9dEvfBQ,Fashion teaching,2012-06-17,"Learn how to draw fashion sketches with fashion illustrator Ioana Avram. I will help you learn how to draw fashion sketches and everything related: composition, ...",Fashion,97736,483.84158415841586,202,4414048,45.16296963247933,21851.72277227723,11.28,0.3682362702134033,8.0,1.6,0.04407232207226534,-0.013392100056710524,87.84,2.5002147290903003,3697.8
538,UC1ztfF0-cd4VX27ItjMoGEg,Colleen G Lea - FSBTV,2011-03-14,"A sewing channel for beginners, intermediate and advanced fashion sewers who want to learn how to sew and transform old clothes, my clear and concise step ...",Fashion,77902,272.38461538461536,286,9823508,126.10084465097174,34347.93006993007,18.38,0.9912353506244618,13.8,3.08,0.13178018210326464,-0.3097885547711634,85.96,3.9391993059351176,3090.98
539,UCFPJjBsefTfivvu7APz2jKA,Simon O. - Latex Fashion,2010-09-07,,Fashion,4732,315.46666666666664,15,1193595,252.23901098901098,79573.0,8.466666666666667,0.019948886479930213,80.1,12.866666666666667,0.023990318589059173,-0.6186934656212194,263.53333333333336,0.5518349444500679,79579.0
540,UCOTIeIEXL9LkkvoVKZDNr3A,British Fashion Council,2012-06-13,"The British Fashion Council promotes British designers to a global market. See coverage across all of the BFC's key events including London Fashion Week, ...",Fashion,24049,18.58500772797527,1294,6692245,278.2753960663645,5171.750386398763,0.14,0.0006629521928522161,4.5,1.92,0.03644821660898477,-0.44857825594717265,77.44,1.0689071493371858,22400.0
541,UCU6vmsP8LiM12-Cb9Ahr1_w,ITALIAN HAIR FASHION,2014-04-22,,Fashion,1693,5.25776397515528,322,1296123,765.5776727702304,4025.226708074534,0.26,0.00862581889938156,13.9,0.84,0.0295473603753966,-0.02480076330446238,8.44,0.3032920713624203,2873.84
542,UCmKcg-ALeO5he8sfQi1_lKw,Modelina Fashion,2012-01-25,"Modelina! Wszystko z modeliny! Porady! Tutoriale! Poznaj modelinową krainę :) !!! Na tym kanale będę uczyć jak wykonywać przeróżne rzeczy z modeliny, ...",Fashion,16188,238.05882352941177,68,3001779,185.43235730170497,44143.80882352941,130.84,0.414576375098521,14.5,37.68,0.08507988470168651,-0.037467374373219994,527.54,1.3450793835784536,40658.2
543,UC0SzfTrkZYMMhYXJZKaXEkA,Women Fashion UK | Video Catalog,2017-10-19,,Fashion,214,0.039917925760119384,5361,124006,579.4672897196261,23.131132251445624,0.0,,0.2,0.0,,inf,0.02,,4.64
544,UCKtAtnO7m01SfURsk9lHthw,Kids Fashion Collections,2016-06-30,Top Selected Kids Fashion Collection from top brends.,Fashion,225,0.049800796812749,4518,105056,466.91555555555556,23.25276671093404,0.0,,0.0,0.0,,inf,0.04,,1.2
545,UCLnOeLmKbbOa8gaWnS5slGg,Men's Fashion | Video Shop,2017-10-23,Men's Clothing Browse the full selection in our Men's Clothing Store and check out our edits for inspiration on top trends and brands. Men's Shoes Whether it's ...,Fashion,609,0.1443127962085308,4220,229376,376.64367816091954,54.354502369668246,0.0,,0.2,0.0,,-5.190065867838897,0.02,,7.06
546,UCLX6XpwAkB00LdK_flDFW2w,fashion flower3,2015-04-07,,Fashion,54155,14.772231314784506,3666,20623248,380.8189086880251,5625.545008183306,0.12,0.035720839088673885,0.2,0.38,0.1879192203023469,-31.64580166340257,3.46,1.2418904891941056,345.66
547,UCkkVe_1wVVhT_w_BU6CKgXw,Fashion9tv,2016-08-10,fashion9tv channel is reference channel for general information purpose only.we do not sell any items on our channel. we bring beautiful collections with price ...,Fashion,50013,13.657291097760787,3662,17123394,342.37886149601104,4675.967777170945,0.0,0.0,0.3,0.22,0.20775687212073782,-0.6001401768833656,1.08,0.5382140659900266,184.98
548,UCM-in3WzMJ4QYI33-E3wPzA,My Fashion,2016-12-23,,Fashion,8865,2.8513991637182374,3109,3081031,347.5500282007896,991.0038597619813,0.02,0.01098901098901099,0.1,0.16,0.12253008004934214,-9.020484875153628,4.78,2.298223851018628,222.04
549,UC5BmqlzijsfmLn1teF53Byw,Fashion Fashion,2016-09-11,,Fashion,3856,1.3273666092943202,2905,1228587,318.61696058091286,422.9215146299484,0.04,0.011167466601544766,-0.0,0.36,0.01800516313878658,,1.64,0.09384968282910477,961.6
550,UCbc1BjP7hJuFh-xFBW0Mdzw,Linda Fashion,2015-08-15,welcome to Linda fashion our channel post daily videos of new dress models clic on subscribe to see them first.,Fashion,163366,58.76474820143885,2780,86011396,526.4950846565381,30939.35107913669,34.68,0.0908782547319036,0.8,48.54,0.08340897955468761,-3.5348866686966636,437.7,1.0724252562264707,58289.32
552,UCrrii_GC9tKX-2BprmNROAA,Random Fashion Stuff,2016-01-18,,Fashion,360256,191.82960596379127,1878,93652927,259.9621574658021,49868.438232161876,0.0,0.0,0.3,3.9,0.06735911497346014,-0.9205077743527834,62.44,1.013596037102827,7199.2
553,UCbObhor98qHGv0pu5h5py9w,Fashion Frames,2015-04-24,"Welcome to Fashion Frames. This Channel For All Type Of Beauty, Fashion and Lifestyle. If You Want More Future Videos From This Channel Please Subscribe.",Fashion,84,0.047754405912450254,1759,22884,272.42857142857144,13.009664582148948,0.0,,0.1,0.0,,inf,0.0,,2.08
554,UCCwc9jFOTCQ0uRhUIW8v_zQ,Moda 2017 Fashion 2018,2016-12-11,Moda 2017 Fashion 2018 mostrara En estos vídeos y vamos a descubrir algunas de las mejores tendencias que van a invadir las tiendas esta temporada y ...,Fashion,22003,13.034952606635072,1688,5236091,237.97168567922557,3101.949644549763,0.12,0.13960399547074104,0.2,0.14,0.1207071367944896,-2.335190406371922,5.94,5.871667163975853,107.52
